6050-6084 avr_updi: start-bit: "Start bit" "Start" "S"
6084-6119 avr_updi: data-bit: "x"
6119-6154 avr_updi: data-bit: "x"
6154-6189 avr_updi: data-bit: "x"
6189-6223 avr_updi: data-bit: "x"
6223-6258 avr_updi: data-bit: "x"
6258-6292 avr_updi: data-bit: "x"
6292-6327 avr_updi: data-bit: "x"
6327-6362 avr_updi: data-bit: "x"
6362-6432 avr_updi: stop-bit: "Stop bit" "Stop" "T"
6050-6432 avr_updi: byte-value: "55"
6050-6432 avr_updi: sync: "SYNC"
6466-6501 avr_updi: start-bit: "Start bit" "Start" "S"
6501-6536 avr_updi: data-bit: "0"
6536-6571 avr_updi: data-bit: "0"
6571-6606 avr_updi: data-bit: "0"
6606-6641 avr_updi: data-bit: "1"
6641-6676 avr_updi: data-bit: "0"
6676-6711 avr_updi: data-bit: "0"
6711-6746 avr_updi: data-bit: "1"
6746-6781 avr_updi: data-bit: "0"
6781-6851 avr_updi: stop-bit: "Stop bit" "Stop" "T"
6466-6851 avr_updi: byte-value: "48"
6466-6851 avr_updi: updi-opcode: "Opcode: STS" "STS"
6882-6917 avr_updi: start-bit: "Start bit" "Start" "S"
6917-6952 avr_updi: data-bit: "1"
6952-6987 avr_updi: data-bit: "0"
6987-7022 avr_updi: data-bit: "0"
7022-7057 avr_updi: data-bit: "0"
7057-7092 avr_updi: data-bit: "0"
7092-7127 avr_updi: data-bit: "0"
7127-7162 avr_updi: data-bit: "0"
7162-7197 avr_updi: data-bit: "0"
7197-7267 avr_updi: stop-bit: "Stop bit" "Stop" "T"
6882-7267 avr_updi: byte-value: "01"
7298-7333 avr_updi: start-bit: "Start bit" "Start" "S"
7333-7368 avr_updi: data-bit: "0"
7368-7403 avr_updi: data-bit: "0"
7403-7438 avr_updi: data-bit: "0"
7438-7473 avr_updi: data-bit: "0"
7473-7508 avr_updi: data-bit: "1"
7508-7543 avr_updi: data-bit: "0"
7543-7578 avr_updi: data-bit: "0"
7578-7613 avr_updi: data-bit: "0"
7613-7683 avr_updi: stop-bit: "Stop bit" "Stop" "T"
7298-7683 avr_updi: byte-value: "10"
7714-7749 avr_updi: start-bit: "Start bit" "Start" "S"
7749-7784 avr_updi: data-bit: "0"
7784-7819 avr_updi: data-bit: "0"
7819-7854 avr_updi: data-bit: "0"
7854-7889 avr_updi: data-bit: "0"
7889-7924 avr_updi: data-bit: "0"
7924-7959 avr_updi: data-bit: "0"
7959-7994 avr_updi: data-bit: "0"
7994-8029 avr_updi: data-bit: "0"
8029-8099 avr_updi: stop-bit: "Stop bit" "Stop" "T"
7714-8099 avr_updi: byte-value: "00"
6882-8099 avr_updi: updi-addr: "Addr: 001001" "001001"
12496-12531 avr_updi: start-bit: "Start bit" "Start" "S"
12531-12566 avr_updi: data-bit: "0"
12566-12601 avr_updi: data-bit: "0"
12601-12636 avr_updi: data-bit: "0"
12636-12671 avr_updi: data-bit: "0"
12671-12706 avr_updi: data-bit: "0"
12706-12741 avr_updi: data-bit: "0"
12741-12776 avr_updi: data-bit: "1"
12776-12811 avr_updi: data-bit: "0"
12811-12881 avr_updi: stop-bit: "Stop bit" "Stop" "T"
12496-12881 avr_updi: byte-value: "40"
12496-12881 avr_updi: updi-ack: "ACK"
17006-17041 avr_updi: start-bit: "Start bit" "Start" "S"
17041-17076 avr_updi: data-bit: "0"
17076-17111 avr_updi: data-bit: "0"
17111-17146 avr_updi: data-bit: "0"
17146-17181 avr_updi: data-bit: "0"
17181-17216 avr_updi: data-bit: "0"
17216-17251 avr_updi: data-bit: "0"
17251-17286 avr_updi: data-bit: "0"
17286-17321 avr_updi: data-bit: "0"
17321-17391 avr_updi: stop-bit: "Stop bit" "Stop" "T"
17006-17391 avr_updi: byte-value: "00"
17006-17391 avr_updi: updi-data: "Data: 00" "00"
21788-21823 avr_updi: start-bit: "Start bit" "Start" "S"
21823-21858 avr_updi: data-bit: "0"
21858-21893 avr_updi: data-bit: "0"
21893-21928 avr_updi: data-bit: "0"
21928-21963 avr_updi: data-bit: "0"
21963-21998 avr_updi: data-bit: "0"
21998-22033 avr_updi: data-bit: "0"
22033-22068 avr_updi: data-bit: "1"
22068-22103 avr_updi: data-bit: "0"
22103-22173 avr_updi: stop-bit: "Stop bit" "Stop" "T"
21788-22173 avr_updi: byte-value: "40"
21788-22173 avr_updi: updi-ack: "ACK"
6050-22173 avr_updi: updi: "STS 001001, 00" "STS"
27720-27754 avr_updi: start-bit: "Start bit" "Start" "S"
27754-27789 avr_updi: data-bit: "x"
27789-27823 avr_updi: data-bit: "x"
27823-27858 avr_updi: data-bit: "x"
27858-27892 avr_updi: data-bit: "x"
27892-27928 avr_updi: data-bit: "x"
27928-27962 avr_updi: data-bit: "x"
27962-27997 avr_updi: data-bit: "x"
27997-28032 avr_updi: data-bit: "x"
28032-28102 avr_updi: stop-bit: "Stop bit" "Stop" "T"
27720-28102 avr_updi: byte-value: "55"
27720-28102 avr_updi: sync: "SYNC"
28136-28171 avr_updi: start-bit: "Start bit" "Start" "S"
28171-28206 avr_updi: data-bit: "0"
28206-28241 avr_updi: data-bit: "0"
28241-28276 avr_updi: data-bit: "0"
28276-28311 avr_updi: data-bit: "1"
28311-28346 avr_updi: data-bit: "0"
28346-28381 avr_updi: data-bit: "0"
28381-28416 avr_updi: data-bit: "1"
28416-28451 avr_updi: data-bit: "0"
28451-28521 avr_updi: stop-bit: "Stop bit" "Stop" "T"
28136-28521 avr_updi: byte-value: "48"
28136-28521 avr_updi: updi-opcode: "Opcode: STS" "STS"
28552-28587 avr_updi: start-bit: "Start bit" "Start" "S"
28587-28622 avr_updi: data-bit: "0"
28622-28657 avr_updi: data-bit: "0"
28657-28692 avr_updi: data-bit: "0"
28692-28727 avr_updi: data-bit: "0"
28727-28762 avr_updi: data-bit: "0"
28762-28797 avr_updi: data-bit: "0"
28797-28832 avr_updi: data-bit: "0"
28832-28867 avr_updi: data-bit: "0"
28867-28937 avr_updi: stop-bit: "Stop bit" "Stop" "T"
28552-28937 avr_updi: byte-value: "00"
28968-29003 avr_updi: start-bit: "Start bit" "Start" "S"
29003-29038 avr_updi: data-bit: "0"
29038-29073 avr_updi: data-bit: "0"
29073-29108 avr_updi: data-bit: "0"
29108-29143 avr_updi: data-bit: "0"
29143-29178 avr_updi: data-bit: "1"
29178-29213 avr_updi: data-bit: "0"
29213-29248 avr_updi: data-bit: "0"
29248-29283 avr_updi: data-bit: "0"
29283-29353 avr_updi: stop-bit: "Stop bit" "Stop" "T"
28968-29353 avr_updi: byte-value: "10"
29384-29419 avr_updi: start-bit: "Start bit" "Start" "S"
29419-29454 avr_updi: data-bit: "0"
29454-29489 avr_updi: data-bit: "0"
29489-29524 avr_updi: data-bit: "0"
29524-29559 avr_updi: data-bit: "0"
29559-29594 avr_updi: data-bit: "0"
29594-29629 avr_updi: data-bit: "0"
29629-29664 avr_updi: data-bit: "0"
29664-29699 avr_updi: data-bit: "0"
29699-29769 avr_updi: stop-bit: "Stop bit" "Stop" "T"
29384-29769 avr_updi: byte-value: "00"
28552-29769 avr_updi: updi-addr: "Addr: 001000" "001000"
34151-34186 avr_updi: start-bit: "Start bit" "Start" "S"
34186-34221 avr_updi: data-bit: "0"
34221-34256 avr_updi: data-bit: "0"
34256-34291 avr_updi: data-bit: "0"
34291-34326 avr_updi: data-bit: "0"
34326-34361 avr_updi: data-bit: "0"
34361-34396 avr_updi: data-bit: "0"
34396-34431 avr_updi: data-bit: "1"
34431-34466 avr_updi: data-bit: "0"
34466-34536 avr_updi: stop-bit: "Stop bit" "Stop" "T"
34151-34536 avr_updi: byte-value: "40"
34151-34536 avr_updi: updi-ack: "ACK"
38329-38364 avr_updi: start-bit: "Start bit" "Start" "S"
38364-38399 avr_updi: data-bit: "0"
38399-38434 avr_updi: data-bit: "1"
38434-38469 avr_updi: data-bit: "0"
38469-38504 avr_updi: data-bit: "0"
38504-38539 avr_updi: data-bit: "0"
38539-38574 avr_updi: data-bit: "0"
38574-38609 avr_updi: data-bit: "0"
38609-38644 avr_updi: data-bit: "0"
38644-38714 avr_updi: stop-bit: "Stop bit" "Stop" "T"
38329-38714 avr_updi: byte-value: "02"
38329-38714 avr_updi: updi-data: "Data: 02" "02"
43094-43129 avr_updi: start-bit: "Start bit" "Start" "S"
43129-43164 avr_updi: data-bit: "0"
43164-43199 avr_updi: data-bit: "0"
43199-43234 avr_updi: data-bit: "0"
43234-43269 avr_updi: data-bit: "0"
43269-43304 avr_updi: data-bit: "0"
43304-43339 avr_updi: data-bit: "0"
43339-43374 avr_updi: data-bit: "1"
43374-43409 avr_updi: data-bit: "0"
43409-43479 avr_updi: stop-bit: "Stop bit" "Stop" "T"
43094-43479 avr_updi: byte-value: "40"
43094-43479 avr_updi: updi-ack: "ACK"
27720-43479 avr_updi: updi: "STS 001000, 02" "STS"
46545-46580 avr_updi: start-bit: "Start bit" "Start" "S"
46580-46615 avr_updi: data-bit: "x"
46615-46649 avr_updi: data-bit: "x"
46649-46684 avr_updi: data-bit: "x"
46684-46718 avr_updi: data-bit: "x"
46718-46753 avr_updi: data-bit: "x"
46753-46788 avr_updi: data-bit: "x"
46788-46823 avr_updi: data-bit: "x"
46823-46858 avr_updi: data-bit: "x"
46858-46928 avr_updi: stop-bit: "Stop bit" "Stop" "T"
46545-46928 avr_updi: byte-value: "55"
46545-46928 avr_updi: sync: "SYNC"
46961-46996 avr_updi: start-bit: "Start bit" "Start" "S"
46996-47031 avr_updi: data-bit: "0"
47031-47066 avr_updi: data-bit: "1"
47066-47101 avr_updi: data-bit: "0"
47101-47136 avr_updi: data-bit: "0"
47136-47171 avr_updi: data-bit: "0"
47171-47206 avr_updi: data-bit: "0"
47206-47241 avr_updi: data-bit: "1"
47241-47276 avr_updi: data-bit: "1"
47276-47346 avr_updi: stop-bit: "Stop bit" "Stop" "T"
46961-47346 avr_updi: byte-value: "C2"
46961-47346 avr_updi: updi-opcode: "Opcode: STCS" "STCS"
47378-47413 avr_updi: start-bit: "Start bit" "Start" "S"
47413-47448 avr_updi: data-bit: "0"
47448-47483 avr_updi: data-bit: "0"
47483-47518 avr_updi: data-bit: "0"
47518-47553 avr_updi: data-bit: "1"
47553-47588 avr_updi: data-bit: "0"
47588-47623 avr_updi: data-bit: "0"
47623-47658 avr_updi: data-bit: "0"
47658-47693 avr_updi: data-bit: "0"
47693-47763 avr_updi: stop-bit: "Stop bit" "Stop" "T"
47378-47763 avr_updi: byte-value: "08"
47378-47763 avr_updi: updi-data: "Data: 08" "08"
46545-47763 avr_updi: updi: "STCS [02], 08" "STCS"
52093-52127 avr_updi: start-bit: "Start bit" "Start" "S"
52127-52162 avr_updi: data-bit: "x"
52162-52196 avr_updi: data-bit: "x"
52196-52231 avr_updi: data-bit: "x"
52231-52266 avr_updi: data-bit: "x"
52266-52301 avr_updi: data-bit: "x"
52301-52335 avr_updi: data-bit: "x"
52335-52370 avr_updi: data-bit: "x"
52370-52405 avr_updi: data-bit: "x"
52405-52475 avr_updi: stop-bit: "Stop bit" "Stop" "T"
52093-52475 avr_updi: byte-value: "55"
52093-52475 avr_updi: sync: "SYNC"
52509-52544 avr_updi: start-bit: "Start bit" "Start" "S"
52544-52579 avr_updi: data-bit: "0"
52579-52614 avr_updi: data-bit: "1"
52614-52649 avr_updi: data-bit: "0"
52649-52684 avr_updi: data-bit: "1"
52684-52719 avr_updi: data-bit: "0"
52719-52754 avr_updi: data-bit: "1"
52754-52789 avr_updi: data-bit: "1"
52789-52824 avr_updi: data-bit: "0"
52824-52894 avr_updi: stop-bit: "Stop bit" "Stop" "T"
52509-52894 avr_updi: byte-value: "6A"
52509-52894 avr_updi: updi-opcode: "Opcode: ST" "ST"
52925-52960 avr_updi: start-bit: "Start bit" "Start" "S"
52960-52995 avr_updi: data-bit: "0"
52995-53030 avr_updi: data-bit: "0"
53030-53065 avr_updi: data-bit: "0"
53065-53100 avr_updi: data-bit: "0"
53100-53135 avr_updi: data-bit: "0"
53135-53170 avr_updi: data-bit: "0"
53170-53205 avr_updi: data-bit: "0"
53205-53240 avr_updi: data-bit: "0"
53240-53310 avr_updi: stop-bit: "Stop bit" "Stop" "T"
52925-53310 avr_updi: byte-value: "00"
53341-53376 avr_updi: start-bit: "Start bit" "Start" "S"
53376-53411 avr_updi: data-bit: "0"
53411-53446 avr_updi: data-bit: "0"
53446-53481 avr_updi: data-bit: "0"
53481-53516 avr_updi: data-bit: "0"
53516-53551 avr_updi: data-bit: "0"
53551-53586 avr_updi: data-bit: "0"
53586-53621 avr_updi: data-bit: "0"
53621-53656 avr_updi: data-bit: "1"
53656-53726 avr_updi: stop-bit: "Stop bit" "Stop" "T"
53341-53726 avr_updi: byte-value: "80"
53757-53792 avr_updi: start-bit: "Start bit" "Start" "S"
53792-53827 avr_updi: data-bit: "0"
53827-53862 avr_updi: data-bit: "0"
53862-53897 avr_updi: data-bit: "0"
53897-53932 avr_updi: data-bit: "0"
53932-53967 avr_updi: data-bit: "0"
53967-54002 avr_updi: data-bit: "0"
54002-54037 avr_updi: data-bit: "0"
54037-54072 avr_updi: data-bit: "0"
54072-54142 avr_updi: stop-bit: "Stop bit" "Stop" "T"
53757-54142 avr_updi: byte-value: "00"
52925-54142 avr_updi: updi-data: "Data: 008000" "008000"
52093-54142 avr_updi: updi: "ST P, 008000" "ST"
56808-56842 avr_updi: start-bit: "Start bit" "Start" "S"
56842-56877 avr_updi: data-bit: "x"
56877-56912 avr_updi: data-bit: "x"
56912-56947 avr_updi: data-bit: "x"
56947-56981 avr_updi: data-bit: "x"
56981-57016 avr_updi: data-bit: "x"
57016-57050 avr_updi: data-bit: "x"
57050-57085 avr_updi: data-bit: "x"
57085-57120 avr_updi: data-bit: "x"
57120-57190 avr_updi: stop-bit: "Stop bit" "Stop" "T"
56808-57190 avr_updi: byte-value: "55"
56808-57190 avr_updi: sync: "SYNC"
57224-57259 avr_updi: start-bit: "Start bit" "Start" "S"
57259-57294 avr_updi: data-bit: "0"
57294-57329 avr_updi: data-bit: "0"
57329-57364 avr_updi: data-bit: "0"
57364-57399 avr_updi: data-bit: "0"
57399-57434 avr_updi: data-bit: "0"
57434-57469 avr_updi: data-bit: "1"
57469-57504 avr_updi: data-bit: "0"
57504-57539 avr_updi: data-bit: "1"
57539-57609 avr_updi: stop-bit: "Stop bit" "Stop" "T"
57224-57609 avr_updi: byte-value: "A0"
57224-57609 avr_updi: updi-opcode: "Opcode: REPEAT" "REPEAT"
57640-57675 avr_updi: start-bit: "Start bit" "Start" "S"
57675-57710 avr_updi: data-bit: "1"
57710-57745 avr_updi: data-bit: "1"
57745-57780 avr_updi: data-bit: "1"
57780-57815 avr_updi: data-bit: "1"
57815-57850 avr_updi: data-bit: "1"
57850-57885 avr_updi: data-bit: "1"
57885-57920 avr_updi: data-bit: "1"
57920-57955 avr_updi: data-bit: "1"
57955-58025 avr_updi: stop-bit: "Stop bit" "Stop" "T"
57640-58025 avr_updi: byte-value: "FF"
57640-58025 avr_updi: updi-data: "Count: FF" "FF"
56808-58025 avr_updi: updi: "REPEAT 255" "REPEAT"
61072-61107 avr_updi: start-bit: "Start bit" "Start" "S"
61107-61142 avr_updi: data-bit: "x"
61142-61176 avr_updi: data-bit: "x"
61176-61211 avr_updi: data-bit: "x"
61211-61245 avr_updi: data-bit: "x"
61245-61280 avr_updi: data-bit: "x"
61280-61315 avr_updi: data-bit: "x"
61315-61350 avr_updi: data-bit: "x"
61350-61385 avr_updi: data-bit: "x"
61385-61455 avr_updi: stop-bit: "Stop bit" "Stop" "T"
61072-61455 avr_updi: byte-value: "55"
61072-61455 avr_updi: sync: "SYNC"
61489-61524 avr_updi: start-bit: "Start bit" "Start" "S"
61524-61559 avr_updi: data-bit: "1"
61559-61594 avr_updi: data-bit: "0"
61594-61629 avr_updi: data-bit: "1"
61629-61664 avr_updi: data-bit: "0"
61664-61699 avr_updi: data-bit: "0"
61699-61734 avr_updi: data-bit: "1"
61734-61769 avr_updi: data-bit: "1"
61769-61804 avr_updi: data-bit: "0"
61804-61874 avr_updi: stop-bit: "Stop bit" "Stop" "T"
61489-61874 avr_updi: byte-value: "65"
61489-61874 avr_updi: updi-opcode: "Opcode: ST" "ST"
66030-66065 avr_updi: start-bit: "Start bit" "Start" "S"
66065-66100 avr_updi: data-bit: "0"
66100-66135 avr_updi: data-bit: "0"
66135-66170 avr_updi: data-bit: "1"
66170-66205 avr_updi: data-bit: "1"
66205-66240 avr_updi: data-bit: "0"
66240-66275 avr_updi: data-bit: "0"
66275-66310 avr_updi: data-bit: "0"
66310-66345 avr_updi: data-bit: "0"
66345-66415 avr_updi: stop-bit: "Stop bit" "Stop" "T"
66030-66415 avr_updi: byte-value: "0C"
66446-66481 avr_updi: start-bit: "Start bit" "Start" "S"
66481-66516 avr_updi: data-bit: "0"
66516-66551 avr_updi: data-bit: "0"
66551-66586 avr_updi: data-bit: "1"
66586-66621 avr_updi: data-bit: "0"
66621-66656 avr_updi: data-bit: "1"
66656-66691 avr_updi: data-bit: "0"
66691-66726 avr_updi: data-bit: "0"
66726-66761 avr_updi: data-bit: "1"
66761-66831 avr_updi: stop-bit: "Stop bit" "Stop" "T"
66446-66831 avr_updi: byte-value: "94"
66030-66831 avr_updi: updi-data: "Data: 940C" "940C"
61072-66831 avr_updi: updi: "ST [P+], 940C" "ST"
66863-66898 avr_updi: start-bit: "Start bit" "Start" "S"
66898-66933 avr_updi: data-bit: "1"
66933-66968 avr_updi: data-bit: "1"
66968-67003 avr_updi: data-bit: "1"
67003-67038 avr_updi: data-bit: "1"
67038-67073 avr_updi: data-bit: "1"
67073-67108 avr_updi: data-bit: "0"
67108-67143 avr_updi: data-bit: "1"
67143-67178 avr_updi: data-bit: "1"
67178-67248 avr_updi: stop-bit: "Stop bit" "Stop" "T"
66863-67248 avr_updi: byte-value: "DF"
67279-67314 avr_updi: start-bit: "Start bit" "Start" "S"
67314-67349 avr_updi: data-bit: "1"
67349-67384 avr_updi: data-bit: "0"
67384-67419 avr_updi: data-bit: "0"
67419-67454 avr_updi: data-bit: "0"
67454-67489 avr_updi: data-bit: "0"
67489-67524 avr_updi: data-bit: "0"
67524-67559 avr_updi: data-bit: "0"
67559-67594 avr_updi: data-bit: "0"
67594-67664 avr_updi: stop-bit: "Stop bit" "Stop" "T"
67279-67664 avr_updi: byte-value: "01"
66863-67664 avr_updi: updi-data: "Data: 01DF" "01DF"
67279-67664 avr_updi: updi: "..., 01DF" "01DF"
67695-67730 avr_updi: start-bit: "Start bit" "Start" "S"
67730-67765 avr_updi: data-bit: "0"
67765-67800 avr_updi: data-bit: "0"
67800-67835 avr_updi: data-bit: "1"
67835-67870 avr_updi: data-bit: "1"
67870-67905 avr_updi: data-bit: "0"
67905-67940 avr_updi: data-bit: "0"
67940-67975 avr_updi: data-bit: "0"
67975-68010 avr_updi: data-bit: "0"
68010-68080 avr_updi: stop-bit: "Stop bit" "Stop" "T"
67695-68080 avr_updi: byte-value: "0C"
68111-68146 avr_updi: start-bit: "Start bit" "Start" "S"
68146-68181 avr_updi: data-bit: "0"
68181-68216 avr_updi: data-bit: "0"
68216-68251 avr_updi: data-bit: "1"
68251-68286 avr_updi: data-bit: "0"
68286-68321 avr_updi: data-bit: "1"
68321-68356 avr_updi: data-bit: "0"
68356-68391 avr_updi: data-bit: "0"
68391-68426 avr_updi: data-bit: "1"
68426-68496 avr_updi: stop-bit: "Stop bit" "Stop" "T"
68111-68496 avr_updi: byte-value: "94"
67695-68496 avr_updi: updi-data: "Data: 940C" "940C"
68111-68496 avr_updi: updi: "..., 940C" "940C"
68527-68562 avr_updi: start-bit: "Start bit" "Start" "S"
68562-68597 avr_updi: data-bit: "1"
68597-68632 avr_updi: data-bit: "0"
68632-68667 avr_updi: data-bit: "0"
68667-68702 avr_updi: data-bit: "0"
68702-68737 avr_updi: data-bit: "1"
68737-68772 avr_updi: data-bit: "1"
68772-68807 avr_updi: data-bit: "1"
68807-68842 avr_updi: data-bit: "1"
68842-68912 avr_updi: stop-bit: "Stop bit" "Stop" "T"
68527-68912 avr_updi: byte-value: "F1"
68943-68978 avr_updi: start-bit: "Start bit" "Start" "S"
68978-69013 avr_updi: data-bit: "1"
69013-69048 avr_updi: data-bit: "0"
69048-69083 avr_updi: data-bit: "0"
69083-69118 avr_updi: data-bit: "0"
69118-69153 avr_updi: data-bit: "0"
69153-69188 avr_updi: data-bit: "0"
69188-69223 avr_updi: data-bit: "0"
69223-69258 avr_updi: data-bit: "0"
69258-69328 avr_updi: stop-bit: "Stop bit" "Stop" "T"
68943-69328 avr_updi: byte-value: "01"
68527-69328 avr_updi: updi-data: "Data: 01F1" "01F1"
68943-69328 avr_updi: updi: "..., 01F1" "01F1"
69359-69394 avr_updi: start-bit: "Start bit" "Start" "S"
69394-69429 avr_updi: data-bit: "0"
69429-69464 avr_updi: data-bit: "0"
69464-69499 avr_updi: data-bit: "1"
69499-69534 avr_updi: data-bit: "1"
69534-69569 avr_updi: data-bit: "0"
69569-69604 avr_updi: data-bit: "0"
69604-69639 avr_updi: data-bit: "0"
69639-69674 avr_updi: data-bit: "0"
69674-69744 avr_updi: stop-bit: "Stop bit" "Stop" "T"
69359-69744 avr_updi: byte-value: "0C"
69775-69810 avr_updi: start-bit: "Start bit" "Start" "S"
69810-69845 avr_updi: data-bit: "0"
69845-69880 avr_updi: data-bit: "0"
69880-69915 avr_updi: data-bit: "1"
69915-69950 avr_updi: data-bit: "0"
69950-69985 avr_updi: data-bit: "1"
69985-70020 avr_updi: data-bit: "0"
70020-70055 avr_updi: data-bit: "0"
70055-70090 avr_updi: data-bit: "1"
70090-70160 avr_updi: stop-bit: "Stop bit" "Stop" "T"
69775-70160 avr_updi: byte-value: "94"
69359-70160 avr_updi: updi-data: "Data: 940C" "940C"
69775-70160 avr_updi: updi: "..., 940C" "940C"
70191-70226 avr_updi: start-bit: "Start bit" "Start" "S"
70226-70261 avr_updi: data-bit: "1"
70261-70296 avr_updi: data-bit: "0"
70296-70331 avr_updi: data-bit: "0"
70331-70366 avr_updi: data-bit: "0"
70366-70401 avr_updi: data-bit: "1"
70401-70436 avr_updi: data-bit: "1"
70436-70471 avr_updi: data-bit: "1"
70471-70506 avr_updi: data-bit: "1"
70506-70576 avr_updi: stop-bit: "Stop bit" "Stop" "T"
70191-70576 avr_updi: byte-value: "F1"
70607-70642 avr_updi: start-bit: "Start bit" "Start" "S"
70642-70677 avr_updi: data-bit: "1"
70677-70712 avr_updi: data-bit: "0"
70712-70747 avr_updi: data-bit: "0"
70747-70782 avr_updi: data-bit: "0"
70782-70817 avr_updi: data-bit: "0"
70817-70852 avr_updi: data-bit: "0"
70852-70887 avr_updi: data-bit: "0"
70887-70922 avr_updi: data-bit: "0"
70922-70992 avr_updi: stop-bit: "Stop bit" "Stop" "T"
70607-70992 avr_updi: byte-value: "01"
70191-70992 avr_updi: updi-data: "Data: 01F1" "01F1"
70607-70992 avr_updi: updi: "..., 01F1" "01F1"
71023-71058 avr_updi: start-bit: "Start bit" "Start" "S"
71058-71093 avr_updi: data-bit: "0"
71093-71128 avr_updi: data-bit: "0"
71128-71163 avr_updi: data-bit: "1"
71163-71198 avr_updi: data-bit: "1"
71198-71233 avr_updi: data-bit: "0"
71233-71268 avr_updi: data-bit: "0"
71268-71303 avr_updi: data-bit: "0"
71303-71338 avr_updi: data-bit: "0"
71338-71408 avr_updi: stop-bit: "Stop bit" "Stop" "T"
71023-71408 avr_updi: byte-value: "0C"
71439-71474 avr_updi: start-bit: "Start bit" "Start" "S"
71474-71509 avr_updi: data-bit: "0"
71509-71544 avr_updi: data-bit: "0"
71544-71579 avr_updi: data-bit: "1"
71579-71614 avr_updi: data-bit: "0"
71614-71649 avr_updi: data-bit: "1"
71649-71684 avr_updi: data-bit: "0"
71684-71719 avr_updi: data-bit: "0"
71719-71754 avr_updi: data-bit: "1"
71754-71824 avr_updi: stop-bit: "Stop bit" "Stop" "T"
71439-71824 avr_updi: byte-value: "94"
71023-71824 avr_updi: updi-data: "Data: 940C" "940C"
71439-71824 avr_updi: updi: "..., 940C" "940C"
71855-71890 avr_updi: start-bit: "Start bit" "Start" "S"
71890-71925 avr_updi: data-bit: "1"
71925-71960 avr_updi: data-bit: "0"
71960-71995 avr_updi: data-bit: "0"
71995-72030 avr_updi: data-bit: "0"
72030-72065 avr_updi: data-bit: "1"
72065-72100 avr_updi: data-bit: "1"
72100-72135 avr_updi: data-bit: "1"
72135-72170 avr_updi: data-bit: "1"
72170-72240 avr_updi: stop-bit: "Stop bit" "Stop" "T"
71855-72240 avr_updi: byte-value: "F1"
72271-72306 avr_updi: start-bit: "Start bit" "Start" "S"
72306-72341 avr_updi: data-bit: "1"
72341-72376 avr_updi: data-bit: "0"
72376-72411 avr_updi: data-bit: "0"
72411-72446 avr_updi: data-bit: "0"
72446-72481 avr_updi: data-bit: "0"
72481-72516 avr_updi: data-bit: "0"
72516-72551 avr_updi: data-bit: "0"
72551-72586 avr_updi: data-bit: "0"
72586-72656 avr_updi: stop-bit: "Stop bit" "Stop" "T"
72271-72656 avr_updi: byte-value: "01"
71855-72656 avr_updi: updi-data: "Data: 01F1" "01F1"
72271-72656 avr_updi: updi: "..., 01F1" "01F1"
