2845-2874 avr_updi: start-bit: "Start bit" "Start" "S"
2874-2914 avr_updi: data-bit: "x"
2914-2943 avr_updi: data-bit: "x"
2943-2983 avr_updi: data-bit: "x"
2983-3013 avr_updi: data-bit: "x"
3013-3053 avr_updi: data-bit: "x"
3053-3082 avr_updi: data-bit: "x"
3082-3122 avr_updi: data-bit: "x"
3122-3157 avr_updi: data-bit: "x"
3157-3227 avr_updi: stop-bit: "Stop bit" "Stop" "T"
2845-3227 avr_updi: byte-value: "55"
2845-3227 avr_updi: sync: "SYNC"
3261-3296 avr_updi: start-bit: "Start bit" "Start" "S"
3296-3331 avr_updi: data-bit: "1"
3331-3366 avr_updi: data-bit: "1"
3366-3401 avr_updi: data-bit: "0"
3401-3436 avr_updi: data-bit: "0"
3436-3471 avr_updi: data-bit: "0"
3471-3506 avr_updi: data-bit: "0"
3506-3541 avr_updi: data-bit: "1"
3541-3576 avr_updi: data-bit: "1"
3576-3646 avr_updi: stop-bit: "Stop bit" "Stop" "T"
3261-3646 avr_updi: byte-value: "C3"
3261-3646 avr_updi: updi-opcode: "Opcode: STCS" "STCS"
3677-3712 avr_updi: start-bit: "Start bit" "Start" "S"
3712-3747 avr_updi: data-bit: "0"
3747-3782 avr_updi: data-bit: "0"
3782-3817 avr_updi: data-bit: "0"
3817-3852 avr_updi: data-bit: "1"
3852-3887 avr_updi: data-bit: "0"
3887-3922 avr_updi: data-bit: "0"
3922-3957 avr_updi: data-bit: "0"
3957-3992 avr_updi: data-bit: "0"
3992-4062 avr_updi: stop-bit: "Stop bit" "Stop" "T"
3677-4062 avr_updi: byte-value: "08"
3677-4062 avr_updi: updi-data: "Data: 08" "08"
2845-4062 avr_updi: updi: "STCS [03], 08" "STCS"
8674-8703 avr_updi: start-bit: "Start bit" "Start" "S"
8703-8743 avr_updi: data-bit: "x"
8743-8773 avr_updi: data-bit: "x"
8773-8813 avr_updi: data-bit: "x"
8813-8842 avr_updi: data-bit: "x"
8842-8882 avr_updi: data-bit: "x"
8882-8911 avr_updi: data-bit: "x"
8911-8952 avr_updi: data-bit: "x"
8952-8987 avr_updi: data-bit: "x"
8987-9057 avr_updi: stop-bit: "Stop bit" "Stop" "T"
8674-9057 avr_updi: byte-value: "55"
8674-9057 avr_updi: sync: "SYNC"
9090-9125 avr_updi: start-bit: "Start bit" "Start" "S"
9125-9160 avr_updi: data-bit: "1"
9160-9195 avr_updi: data-bit: "0"
9195-9230 avr_updi: data-bit: "1"
9230-9265 avr_updi: data-bit: "0"
9265-9300 avr_updi: data-bit: "0"
9300-9335 avr_updi: data-bit: "1"
9335-9370 avr_updi: data-bit: "1"
9370-9405 avr_updi: data-bit: "1"
9405-9475 avr_updi: stop-bit: "Stop bit" "Stop" "T"
9090-9475 avr_updi: byte-value: "E5"
9090-9475 avr_updi: updi-opcode: "Opcode: READSIB" "READSIB"
13871-13906 avr_updi: start-bit: "Start bit" "Start" "S"
13906-13941 avr_updi: data-bit: "1"
13941-13976 avr_updi: data-bit: "0"
13976-14011 avr_updi: data-bit: "0"
14011-14046 avr_updi: data-bit: "0"
14046-14081 avr_updi: data-bit: "0"
14081-14116 avr_updi: data-bit: "0"
14116-14151 avr_updi: data-bit: "1"
14151-14186 avr_updi: data-bit: "0"
14186-14256 avr_updi: stop-bit: "Stop bit" "Stop" "T"
13871-14256 avr_updi: byte-value: "41"
14289-14324 avr_updi: start-bit: "Start bit" "Start" "S"
14324-14359 avr_updi: data-bit: "0"
14359-14394 avr_updi: data-bit: "1"
14394-14429 avr_updi: data-bit: "1"
14429-14464 avr_updi: data-bit: "0"
14464-14499 avr_updi: data-bit: "1"
14499-14534 avr_updi: data-bit: "0"
14534-14569 avr_updi: data-bit: "1"
14569-14604 avr_updi: data-bit: "0"
14604-14674 avr_updi: stop-bit: "Stop bit" "Stop" "T"
14289-14674 avr_updi: byte-value: "56"
14707-14742 avr_updi: start-bit: "Start bit" "Start" "S"
14742-14777 avr_updi: data-bit: "0"
14777-14812 avr_updi: data-bit: "1"
14812-14847 avr_updi: data-bit: "0"
14847-14882 avr_updi: data-bit: "0"
14882-14917 avr_updi: data-bit: "1"
14917-14952 avr_updi: data-bit: "0"
14952-14987 avr_updi: data-bit: "1"
14987-15022 avr_updi: data-bit: "0"
15022-15092 avr_updi: stop-bit: "Stop bit" "Stop" "T"
14707-15092 avr_updi: byte-value: "52"
15124-15159 avr_updi: start-bit: "Start bit" "Start" "S"
15159-15194 avr_updi: data-bit: "0"
15194-15229 avr_updi: data-bit: "0"
15229-15264 avr_updi: data-bit: "0"
15264-15299 avr_updi: data-bit: "0"
15299-15334 avr_updi: data-bit: "0"
15334-15369 avr_updi: data-bit: "1"
15369-15404 avr_updi: data-bit: "0"
15404-15439 avr_updi: data-bit: "0"
15439-15509 avr_updi: stop-bit: "Stop bit" "Stop" "T"
15124-15509 avr_updi: byte-value: "20"
15542-15577 avr_updi: start-bit: "Start bit" "Start" "S"
15577-15612 avr_updi: data-bit: "0"
15612-15647 avr_updi: data-bit: "0"
15647-15682 avr_updi: data-bit: "0"
15682-15717 avr_updi: data-bit: "0"
15717-15752 avr_updi: data-bit: "0"
15752-15787 avr_updi: data-bit: "1"
15787-15822 avr_updi: data-bit: "0"
15822-15857 avr_updi: data-bit: "0"
15857-15927 avr_updi: stop-bit: "Stop bit" "Stop" "T"
15542-15927 avr_updi: byte-value: "20"
15960-15995 avr_updi: start-bit: "Start bit" "Start" "S"
15995-16030 avr_updi: data-bit: "0"
16030-16065 avr_updi: data-bit: "0"
16065-16100 avr_updi: data-bit: "0"
16100-16135 avr_updi: data-bit: "0"
16135-16170 avr_updi: data-bit: "0"
16170-16205 avr_updi: data-bit: "1"
16205-16240 avr_updi: data-bit: "0"
16240-16275 avr_updi: data-bit: "0"
16275-16345 avr_updi: stop-bit: "Stop bit" "Stop" "T"
15960-16345 avr_updi: byte-value: "20"
16377-16412 avr_updi: start-bit: "Start bit" "Start" "S"
16412-16447 avr_updi: data-bit: "0"
16447-16482 avr_updi: data-bit: "0"
16482-16517 avr_updi: data-bit: "0"
16517-16552 avr_updi: data-bit: "0"
16552-16587 avr_updi: data-bit: "0"
16587-16622 avr_updi: data-bit: "1"
16622-16657 avr_updi: data-bit: "0"
16657-16692 avr_updi: data-bit: "0"
16692-16762 avr_updi: stop-bit: "Stop bit" "Stop" "T"
16377-16762 avr_updi: byte-value: "20"
16795-16830 avr_updi: start-bit: "Start bit" "Start" "S"
16830-16865 avr_updi: data-bit: "0"
16865-16900 avr_updi: data-bit: "0"
16900-16935 avr_updi: data-bit: "0"
16935-16970 avr_updi: data-bit: "0"
16970-17005 avr_updi: data-bit: "0"
17005-17040 avr_updi: data-bit: "1"
17040-17075 avr_updi: data-bit: "0"
17075-17110 avr_updi: data-bit: "0"
17110-17180 avr_updi: stop-bit: "Stop bit" "Stop" "T"
16795-17180 avr_updi: byte-value: "20"
17212-17247 avr_updi: start-bit: "Start bit" "Start" "S"
17247-17282 avr_updi: data-bit: "0"
17282-17317 avr_updi: data-bit: "0"
17317-17352 avr_updi: data-bit: "0"
17352-17387 avr_updi: data-bit: "0"
17387-17422 avr_updi: data-bit: "1"
17422-17457 avr_updi: data-bit: "0"
17457-17492 avr_updi: data-bit: "1"
17492-17527 avr_updi: data-bit: "0"
17527-17597 avr_updi: stop-bit: "Stop bit" "Stop" "T"
17212-17597 avr_updi: byte-value: "50"
17630-17665 avr_updi: start-bit: "Start bit" "Start" "S"
17665-17700 avr_updi: data-bit: "0"
17700-17735 avr_updi: data-bit: "1"
17735-17770 avr_updi: data-bit: "0"
17770-17805 avr_updi: data-bit: "1"
17805-17840 avr_updi: data-bit: "1"
17840-17875 avr_updi: data-bit: "1"
17875-17910 avr_updi: data-bit: "0"
17910-17945 avr_updi: data-bit: "0"
17945-18015 avr_updi: stop-bit: "Stop bit" "Stop" "T"
17630-18015 avr_updi: byte-value: "3A"
18048-18083 avr_updi: start-bit: "Start bit" "Start" "S"
18083-18118 avr_updi: data-bit: "0"
18118-18153 avr_updi: data-bit: "1"
18153-18188 avr_updi: data-bit: "0"
18188-18223 avr_updi: data-bit: "0"
18223-18258 avr_updi: data-bit: "1"
18258-18293 avr_updi: data-bit: "1"
18293-18328 avr_updi: data-bit: "0"
18328-18363 avr_updi: data-bit: "0"
18363-18433 avr_updi: stop-bit: "Stop bit" "Stop" "T"
18048-18433 avr_updi: byte-value: "32"
18465-18500 avr_updi: start-bit: "Start bit" "Start" "S"
18500-18535 avr_updi: data-bit: "0"
18535-18570 avr_updi: data-bit: "0"
18570-18605 avr_updi: data-bit: "1"
18605-18640 avr_updi: data-bit: "0"
18640-18675 avr_updi: data-bit: "0"
18675-18710 avr_updi: data-bit: "0"
18710-18745 avr_updi: data-bit: "1"
18745-18780 avr_updi: data-bit: "0"
18780-18850 avr_updi: stop-bit: "Stop bit" "Stop" "T"
18465-18850 avr_updi: byte-value: "44"
18883-18918 avr_updi: start-bit: "Start bit" "Start" "S"
18918-18953 avr_updi: data-bit: "0"
18953-18988 avr_updi: data-bit: "1"
18988-19023 avr_updi: data-bit: "0"
19023-19058 avr_updi: data-bit: "1"
19058-19093 avr_updi: data-bit: "1"
19093-19128 avr_updi: data-bit: "1"
19128-19163 avr_updi: data-bit: "0"
19163-19198 avr_updi: data-bit: "0"
19198-19268 avr_updi: stop-bit: "Stop bit" "Stop" "T"
18883-19268 avr_updi: byte-value: "3A"
19301-19336 avr_updi: start-bit: "Start bit" "Start" "S"
19336-19371 avr_updi: data-bit: "1"
19371-19406 avr_updi: data-bit: "0"
19406-19441 avr_updi: data-bit: "0"
19441-19476 avr_updi: data-bit: "0"
19476-19511 avr_updi: data-bit: "1"
19511-19546 avr_updi: data-bit: "1"
19546-19581 avr_updi: data-bit: "0"
19581-19616 avr_updi: data-bit: "0"
19616-19686 avr_updi: stop-bit: "Stop bit" "Stop" "T"
19301-19686 avr_updi: byte-value: "31"
19718-19753 avr_updi: start-bit: "Start bit" "Start" "S"
19753-19788 avr_updi: data-bit: "1"
19788-19823 avr_updi: data-bit: "0"
19823-19858 avr_updi: data-bit: "1"
19858-19893 avr_updi: data-bit: "1"
19893-19928 avr_updi: data-bit: "0"
19928-19963 avr_updi: data-bit: "1"
19963-19998 avr_updi: data-bit: "0"
19998-20033 avr_updi: data-bit: "0"
20033-20103 avr_updi: stop-bit: "Stop bit" "Stop" "T"
19718-20103 avr_updi: byte-value: "2D"
20136-20171 avr_updi: start-bit: "Start bit" "Start" "S"
20171-20206 avr_updi: data-bit: "1"
20206-20241 avr_updi: data-bit: "1"
20241-20276 avr_updi: data-bit: "0"
20276-20311 avr_updi: data-bit: "0"
20311-20346 avr_updi: data-bit: "1"
20346-20381 avr_updi: data-bit: "1"
20381-20416 avr_updi: data-bit: "0"
20416-20451 avr_updi: data-bit: "0"
20451-20521 avr_updi: stop-bit: "Stop bit" "Stop" "T"
20136-20521 avr_updi: byte-value: "33"
13871-20521 avr_updi: updi-data: "SIB: 4156522020202020503A32443A312D33" "4156522020202020503A32443A312D33"
8674-20521 avr_updi: updi: "READSIB"
