346-350 avr_updi: start-bit: "S"
350-354 avr_updi: data-bit: "b0"
354-358 avr_updi: data-bit: "b1"
358-362 avr_updi: data-bit: "b2"
362-366 avr_updi: data-bit: "b3"
366-370 avr_updi: data-bit: "b4"
370-374 avr_updi: data-bit: "b5"
374-378 avr_updi: data-bit: "b6"
378-382 avr_updi: data-bit: "b7"
382-390 avr_updi: stop-bit: "P"
346-390 avr_updi: byte-value: "55"
346-390 avr_updi: sync: "SYNC"
436-440 avr_updi: start-bit: "S"
440-444 avr_updi: data-bit: "1"
444-448 avr_updi: data-bit: "0"
448-452 avr_updi: data-bit: "0"
452-456 avr_updi: data-bit: "1"
456-460 avr_updi: data-bit: "0"
460-464 avr_updi: data-bit: "1"
464-468 avr_updi: data-bit: "1"
468-472 avr_updi: data-bit: "0"
472-480 avr_updi: stop-bit: "P"
436-480 avr_updi: byte-value: "69"
436-480 avr_updi: updi-opcode: "ST"
526-530 avr_updi: start-bit: "S"
530-534 avr_updi: data-bit: "0"
534-538 avr_updi: data-bit: "0"
538-542 avr_updi: data-bit: "0"
542-546 avr_updi: data-bit: "0"
546-550 avr_updi: data-bit: "0"
550-554 avr_updi: data-bit: "0"
554-558 avr_updi: data-bit: "0"
558-562 avr_updi: data-bit: "0"
562-570 avr_updi: stop-bit: "P"
526-570 avr_updi: byte-value: "00"
616-620 avr_updi: start-bit: "S"
620-624 avr_updi: data-bit: "1"
624-628 avr_updi: data-bit: "0"
628-632 avr_updi: data-bit: "0"
632-636 avr_updi: data-bit: "0"
636-640 avr_updi: data-bit: "1"
640-644 avr_updi: data-bit: "0"
644-648 avr_updi: data-bit: "0"
648-652 avr_updi: data-bit: "0"
652-660 avr_updi: stop-bit: "P"
616-660 avr_updi: byte-value: "11"
526-660 avr_updi: updi-data: "data"
1166-1170 avr_updi: start-bit: "S"
1170-1174 avr_updi: data-bit: "0"
1174-1178 avr_updi: data-bit: "0"
1178-1182 avr_updi: data-bit: "0"
1182-1186 avr_updi: data-bit: "0"
1186-1190 avr_updi: data-bit: "0"
1190-1194 avr_updi: data-bit: "0"
1194-1198 avr_updi: data-bit: "1"
1198-1202 avr_updi: data-bit: "0"
1202-1210 avr_updi: stop-bit: "P"
1166-1210 avr_updi: byte-value: "40"
1166-1210 avr_updi: updi-ack: "ACK"
346-1210 avr_updi: updi: "ST P, 1100"
1247-1251 avr_updi: start-bit: "S"
1251-1255 avr_updi: data-bit: "b0"
1255-1259 avr_updi: data-bit: "b1"
1259-1263 avr_updi: data-bit: "b2"
1263-1267 avr_updi: data-bit: "b3"
1267-1271 avr_updi: data-bit: "b4"
1271-1275 avr_updi: data-bit: "b5"
1275-1279 avr_updi: data-bit: "b6"
1279-1283 avr_updi: data-bit: "b7"
1283-1291 avr_updi: stop-bit: "P"
1247-1291 avr_updi: byte-value: "55"
1247-1291 avr_updi: sync: "SYNC"
1337-1341 avr_updi: start-bit: "S"
1341-1345 avr_updi: data-bit: "1"
1345-1349 avr_updi: data-bit: "0"
1349-1353 avr_updi: data-bit: "0"
1353-1357 avr_updi: data-bit: "0"
1357-1361 avr_updi: data-bit: "0"
1361-1365 avr_updi: data-bit: "1"
1365-1369 avr_updi: data-bit: "0"
1369-1373 avr_updi: data-bit: "1"
1373-1381 avr_updi: stop-bit: "P"
1337-1381 avr_updi: byte-value: "A1"
1337-1381 avr_updi: updi-opcode: "REPEAT"
1426-1430 avr_updi: start-bit: "S"
1430-1434 avr_updi: data-bit: "0"
1434-1438 avr_updi: data-bit: "1"
1438-1442 avr_updi: data-bit: "0"
1442-1446 avr_updi: data-bit: "0"
1446-1450 avr_updi: data-bit: "0"
1450-1454 avr_updi: data-bit: "0"
1454-1458 avr_updi: data-bit: "0"
1458-1462 avr_updi: data-bit: "0"
1462-1470 avr_updi: stop-bit: "P"
1426-1470 avr_updi: byte-value: "02"
1516-1520 avr_updi: start-bit: "S"
1520-1524 avr_updi: data-bit: "0"
1524-1528 avr_updi: data-bit: "0"
1528-1532 avr_updi: data-bit: "0"
1532-1536 avr_updi: data-bit: "0"
1536-1540 avr_updi: data-bit: "0"
1540-1544 avr_updi: data-bit: "0"
1544-1548 avr_updi: data-bit: "0"
1548-1552 avr_updi: data-bit: "0"
1552-1560 avr_updi: stop-bit: "P"
1516-1560 avr_updi: byte-value: "00"
1426-1560 avr_updi: updi-data: "count"
1247-1560 avr_updi: updi: "REPEAT 2"
1635-1639 avr_updi: start-bit: "S"
1639-1643 avr_updi: data-bit: "b0"
1643-1647 avr_updi: data-bit: "b1"
1647-1651 avr_updi: data-bit: "b2"
1651-1655 avr_updi: data-bit: "b3"
1655-1659 avr_updi: data-bit: "b4"
1659-1663 avr_updi: data-bit: "b5"
1663-1667 avr_updi: data-bit: "b6"
1667-1671 avr_updi: data-bit: "b7"
1671-1679 avr_updi: stop-bit: "P"
1635-1679 avr_updi: byte-value: "55"
1635-1679 avr_updi: sync: "SYNC"
1725-1729 avr_updi: start-bit: "S"
1729-1733 avr_updi: data-bit: "0"
1733-1737 avr_updi: data-bit: "0"
1737-1741 avr_updi: data-bit: "1"
1741-1745 avr_updi: data-bit: "0"
1745-1749 avr_updi: data-bit: "0"
1749-1753 avr_updi: data-bit: "1"
1753-1757 avr_updi: data-bit: "0"
1757-1761 avr_updi: data-bit: "0"
1761-1769 avr_updi: stop-bit: "P"
1725-1769 avr_updi: byte-value: "24"
1725-1769 avr_updi: updi-opcode: "LD"
2275-2279 avr_updi: start-bit: "S"
2279-2283 avr_updi: data-bit: "0"
2283-2287 avr_updi: data-bit: "1"
2287-2291 avr_updi: data-bit: "1"
2291-2295 avr_updi: data-bit: "1"
2295-2299 avr_updi: data-bit: "1"
2299-2303 avr_updi: data-bit: "0"
2303-2307 avr_updi: data-bit: "0"
2307-2311 avr_updi: data-bit: "0"
2311-2319 avr_updi: stop-bit: "P"
2275-2319 avr_updi: byte-value: "1E"
2275-2319 avr_updi: updi-data: "data"
1635-2319 avr_updi: updi: "LD [P+] <- 1E"
2331-2335 avr_updi: start-bit: "S"
2335-2339 avr_updi: data-bit: "1"
2339-2343 avr_updi: data-bit: "1"
2343-2347 avr_updi: data-bit: "0"
2347-2351 avr_updi: data-bit: "0"
2351-2355 avr_updi: data-bit: "1"
2355-2359 avr_updi: data-bit: "0"
2359-2363 avr_updi: data-bit: "0"
2363-2367 avr_updi: data-bit: "1"
2367-2375 avr_updi: stop-bit: "P"
2331-2375 avr_updi: byte-value: "93"
2331-2375 avr_updi: updi-data: "data"
2331-2375 avr_updi: updi: "93"
2381-2385 avr_updi: start-bit: "S"
2385-2389 avr_updi: data-bit: "0"
2389-2393 avr_updi: data-bit: "0"
2393-2397 avr_updi: data-bit: "0"
2397-2401 avr_updi: data-bit: "0"
2401-2405 avr_updi: data-bit: "0"
2405-2409 avr_updi: data-bit: "1"
2409-2413 avr_updi: data-bit: "0"
2413-2417 avr_updi: data-bit: "0"
2417-2425 avr_updi: stop-bit: "P"
2381-2425 avr_updi: byte-value: "20"
2381-2425 avr_updi: updi-data: "data"
2381-2425 avr_updi: updi: "20"
