67433-67441 avr_updi: start-bit: "Start bit" "Start" "S"
67441-67450 avr_updi: data-bit: "x"
67450-67459 avr_updi: data-bit: "x"
67459-67468 avr_updi: data-bit: "x"
67468-67476 avr_updi: data-bit: "x"
67476-67485 avr_updi: data-bit: "x"
67485-67493 avr_updi: data-bit: "x"
67493-67502 avr_updi: data-bit: "x"
67502-67511 avr_updi: data-bit: "x"
67511-67529 avr_updi: stop-bit: "Stop bit" "Stop" "T"
67433-67529 avr_updi: byte-value: "55"
67433-67529 avr_updi: sync: "SYNC"
67537-67546 avr_updi: start-bit: "Start bit" "Start" "S"
67546-67555 avr_updi: data-bit: "1"
67555-67564 avr_updi: data-bit: "1"
67564-67573 avr_updi: data-bit: "0"
67573-67582 avr_updi: data-bit: "0"
67582-67591 avr_updi: data-bit: "0"
67591-67600 avr_updi: data-bit: "0"
67600-67609 avr_updi: data-bit: "1"
67609-67618 avr_updi: data-bit: "1"
67618-67636 avr_updi: stop-bit: "Stop bit" "Stop" "T"
67537-67636 avr_updi: byte-value: "C3"
67537-67636 avr_updi: updi-opcode: "Opcode: STCS" "STCS"
67642-67651 avr_updi: start-bit: "Start bit" "Start" "S"
67651-67660 avr_updi: data-bit: "0"
67660-67669 avr_updi: data-bit: "0"
67669-67678 avr_updi: data-bit: "0"
67678-67687 avr_updi: data-bit: "1"
67687-67696 avr_updi: data-bit: "0"
67696-67705 avr_updi: data-bit: "0"
67705-67714 avr_updi: data-bit: "0"
67714-67723 avr_updi: data-bit: "0"
67723-67741 avr_updi: stop-bit: "Stop bit" "Stop" "T"
67642-67741 avr_updi: byte-value: "08"
67642-67741 avr_updi: updi-data: "Data: 08" "08"
67433-67741 avr_updi: updi: "STCS [03], 08" "STCS"
68773-68781 avr_updi: start-bit: "Start bit" "Start" "S"
68781-68790 avr_updi: data-bit: "x"
68790-68799 avr_updi: data-bit: "x"
68799-68808 avr_updi: data-bit: "x"
68808-68816 avr_updi: data-bit: "x"
68816-68825 avr_updi: data-bit: "x"
68825-68834 avr_updi: data-bit: "x"
68834-68842 avr_updi: data-bit: "x"
68842-68851 avr_updi: data-bit: "x"
68851-68869 avr_updi: stop-bit: "Stop bit" "Stop" "T"
68773-68869 avr_updi: byte-value: "55"
68773-68869 avr_updi: sync: "SYNC"
68877-68886 avr_updi: start-bit: "Start bit" "Start" "S"
68886-68895 avr_updi: data-bit: "1"
68895-68904 avr_updi: data-bit: "1"
68904-68913 avr_updi: data-bit: "0"
68913-68922 avr_updi: data-bit: "1"
68922-68931 avr_updi: data-bit: "0"
68931-68940 avr_updi: data-bit: "0"
68940-68949 avr_updi: data-bit: "0"
68949-68958 avr_updi: data-bit: "1"
68958-68976 avr_updi: stop-bit: "Stop bit" "Stop" "T"
68877-68976 avr_updi: byte-value: "8B"
68877-68976 avr_updi: updi-opcode: "Opcode: LDCS" "LDCS"
70077-70086 avr_updi: start-bit: "Start bit" "Start" "S"
70086-70095 avr_updi: data-bit: "0"
70095-70104 avr_updi: data-bit: "1"
70104-70113 avr_updi: data-bit: "0"
70113-70122 avr_updi: data-bit: "0"
70122-70131 avr_updi: data-bit: "0"
70131-70140 avr_updi: data-bit: "1"
70140-70149 avr_updi: data-bit: "0"
70149-70158 avr_updi: data-bit: "1"
70158-70176 avr_updi: stop-bit: "Stop bit" "Stop" "T"
70077-70176 avr_updi: byte-value: "A2"
70077-70176 avr_updi: updi-data: "Data: A2" "A2"
68773-70176 avr_updi: updi: "LDCS [0B] <- A2" "LDCS"
71409-71418 avr_updi: start-bit: "Start bit" "Start" "S"
71418-71427 avr_updi: data-bit: "x"
71427-71435 avr_updi: data-bit: "x"
71435-71444 avr_updi: data-bit: "x"
71444-71453 avr_updi: data-bit: "x"
71453-71462 avr_updi: data-bit: "x"
71462-71470 avr_updi: data-bit: "x"
71470-71479 avr_updi: data-bit: "x"
71479-71488 avr_updi: data-bit: "x"
71488-71506 avr_updi: stop-bit: "Stop bit" "Stop" "T"
71409-71506 avr_updi: byte-value: "55"
71409-71506 avr_updi: sync: "SYNC"
71514-71523 avr_updi: start-bit: "Start bit" "Start" "S"
71523-71532 avr_updi: data-bit: "0"
71532-71541 avr_updi: data-bit: "0"
71541-71550 avr_updi: data-bit: "0"
71550-71559 avr_updi: data-bit: "0"
71559-71568 avr_updi: data-bit: "0"
71568-71577 avr_updi: data-bit: "1"
71577-71586 avr_updi: data-bit: "1"
71586-71595 avr_updi: data-bit: "1"
71595-71613 avr_updi: stop-bit: "Stop bit" "Stop" "T"
71514-71613 avr_updi: byte-value: "E0"
71514-71613 avr_updi: updi-opcode: "Opcode: KEY" "KEY"
71618-71627 avr_updi: start-bit: "Start bit" "Start" "S"
71627-71636 avr_updi: data-bit: "0"
71636-71645 avr_updi: data-bit: "0"
71645-71654 avr_updi: data-bit: "0"
71654-71663 avr_updi: data-bit: "0"
71663-71672 avr_updi: data-bit: "0"
71672-71681 avr_updi: data-bit: "1"
71681-71690 avr_updi: data-bit: "0"
71690-71699 avr_updi: data-bit: "0"
71699-71717 avr_updi: stop-bit: "Stop bit" "Stop" "T"
71618-71717 avr_updi: byte-value: "20"
71723-71732 avr_updi: start-bit: "Start bit" "Start" "S"
71732-71741 avr_updi: data-bit: "1"
71741-71750 avr_updi: data-bit: "1"
71750-71759 avr_updi: data-bit: "1"
71759-71768 avr_updi: data-bit: "0"
71768-71777 avr_updi: data-bit: "0"
71777-71786 avr_updi: data-bit: "1"
71786-71795 avr_updi: data-bit: "1"
71795-71804 avr_updi: data-bit: "0"
71804-71822 avr_updi: stop-bit: "Stop bit" "Stop" "T"
71723-71822 avr_updi: byte-value: "67"
71827-71836 avr_updi: start-bit: "Start bit" "Start" "S"
71836-71845 avr_updi: data-bit: "1"
71845-71854 avr_updi: data-bit: "1"
71854-71863 avr_updi: data-bit: "1"
71863-71872 avr_updi: data-bit: "1"
71872-71881 avr_updi: data-bit: "0"
71881-71890 avr_updi: data-bit: "1"
71890-71899 avr_updi: data-bit: "1"
71899-71908 avr_updi: data-bit: "0"
71908-71926 avr_updi: stop-bit: "Stop bit" "Stop" "T"
71827-71926 avr_updi: byte-value: "6F"
71932-71941 avr_updi: start-bit: "Start bit" "Start" "S"
71941-71950 avr_updi: data-bit: "0"
71950-71959 avr_updi: data-bit: "1"
71959-71968 avr_updi: data-bit: "0"
71968-71977 avr_updi: data-bit: "0"
71977-71986 avr_updi: data-bit: "1"
71986-71995 avr_updi: data-bit: "1"
71995-72004 avr_updi: data-bit: "1"
72004-72013 avr_updi: data-bit: "0"
72013-72031 avr_updi: stop-bit: "Stop bit" "Stop" "T"
71932-72031 avr_updi: byte-value: "72"
72036-72045 avr_updi: start-bit: "Start bit" "Start" "S"
72045-72054 avr_updi: data-bit: "0"
72054-72063 avr_updi: data-bit: "0"
72063-72072 avr_updi: data-bit: "0"
72072-72081 avr_updi: data-bit: "0"
72081-72090 avr_updi: data-bit: "1"
72090-72099 avr_updi: data-bit: "0"
72099-72108 avr_updi: data-bit: "1"
72108-72117 avr_updi: data-bit: "0"
72117-72135 avr_updi: stop-bit: "Stop bit" "Stop" "T"
72036-72135 avr_updi: byte-value: "50"
72140-72149 avr_updi: start-bit: "Start bit" "Start" "S"
72149-72158 avr_updi: data-bit: "1"
72158-72167 avr_updi: data-bit: "0"
72167-72176 avr_updi: data-bit: "1"
72176-72185 avr_updi: data-bit: "1"
72185-72194 avr_updi: data-bit: "0"
72194-72203 avr_updi: data-bit: "0"
72203-72212 avr_updi: data-bit: "1"
72212-72221 avr_updi: data-bit: "0"
72221-72239 avr_updi: stop-bit: "Stop bit" "Stop" "T"
72140-72239 avr_updi: byte-value: "4D"
72245-72254 avr_updi: start-bit: "Start bit" "Start" "S"
72254-72263 avr_updi: data-bit: "0"
72263-72272 avr_updi: data-bit: "1"
72272-72281 avr_updi: data-bit: "1"
72281-72290 avr_updi: data-bit: "0"
72290-72299 avr_updi: data-bit: "1"
72299-72308 avr_updi: data-bit: "0"
72308-72317 avr_updi: data-bit: "1"
72317-72326 avr_updi: data-bit: "0"
72326-72344 avr_updi: stop-bit: "Stop bit" "Stop" "T"
72245-72344 avr_updi: byte-value: "56"
72349-72358 avr_updi: start-bit: "Start bit" "Start" "S"
72358-72367 avr_updi: data-bit: "0"
72367-72376 avr_updi: data-bit: "1"
72376-72385 avr_updi: data-bit: "1"
72385-72394 avr_updi: data-bit: "1"
72394-72403 avr_updi: data-bit: "0"
72403-72412 avr_updi: data-bit: "0"
72412-72421 avr_updi: data-bit: "1"
72421-72430 avr_updi: data-bit: "0"
72430-72448 avr_updi: stop-bit: "Stop bit" "Stop" "T"
72349-72448 avr_updi: byte-value: "4E"
71618-72448 avr_updi: updi-data: "Key: 20676F72504D564E" "20676F72504D564E"
71409-72448 avr_updi: updi: "KEY 0x20676F72504D564E" "KEY"
73454-73463 avr_updi: start-bit: "Start bit" "Start" "S"
73463-73472 avr_updi: data-bit: "x"
73472-73480 avr_updi: data-bit: "x"
73480-73489 avr_updi: data-bit: "x"
73489-73498 avr_updi: data-bit: "x"
73498-73507 avr_updi: data-bit: "x"
73507-73515 avr_updi: data-bit: "x"
73515-73524 avr_updi: data-bit: "x"
73524-73533 avr_updi: data-bit: "x"
73533-73551 avr_updi: stop-bit: "Stop bit" "Stop" "T"
73454-73551 avr_updi: byte-value: "55"
73454-73551 avr_updi: sync: "SYNC"
73559-73568 avr_updi: start-bit: "Start bit" "Start" "S"
73568-73577 avr_updi: data-bit: "1"
73577-73586 avr_updi: data-bit: "1"
73586-73595 avr_updi: data-bit: "1"
73595-73604 avr_updi: data-bit: "0"
73604-73613 avr_updi: data-bit: "0"
73613-73622 avr_updi: data-bit: "0"
73622-73631 avr_updi: data-bit: "0"
73631-73640 avr_updi: data-bit: "1"
73640-73658 avr_updi: stop-bit: "Stop bit" "Stop" "T"
73559-73658 avr_updi: byte-value: "87"
73559-73658 avr_updi: updi-opcode: "Opcode: LDCS" "LDCS"
74759-74768 avr_updi: start-bit: "Start bit" "Start" "S"
74768-74777 avr_updi: data-bit: "0"
74777-74786 avr_updi: data-bit: "0"
74786-74795 avr_updi: data-bit: "0"
74795-74804 avr_updi: data-bit: "0"
74804-74813 avr_updi: data-bit: "1"
74813-74822 avr_updi: data-bit: "0"
74822-74831 avr_updi: data-bit: "0"
74831-74840 avr_updi: data-bit: "0"
74840-74858 avr_updi: stop-bit: "Stop bit" "Stop" "T"
74759-74858 avr_updi: byte-value: "10"
74759-74858 avr_updi: updi-data: "Data: 10" "10"
73454-74858 avr_updi: updi: "LDCS [07] <- 10" "LDCS"
75821-75830 avr_updi: start-bit: "Start bit" "Start" "S"
75830-75839 avr_updi: data-bit: "x"
75839-75847 avr_updi: data-bit: "x"
75847-75856 avr_updi: data-bit: "x"
75856-75864 avr_updi: data-bit: "x"
75864-75873 avr_updi: data-bit: "x"
75873-75882 avr_updi: data-bit: "x"
75882-75891 avr_updi: data-bit: "x"
75891-75900 avr_updi: data-bit: "x"
75900-75918 avr_updi: stop-bit: "Stop bit" "Stop" "T"
75821-75918 avr_updi: byte-value: "55"
75821-75918 avr_updi: sync: "SYNC"
75926-75935 avr_updi: start-bit: "Start bit" "Start" "S"
75935-75944 avr_updi: data-bit: "0"
75944-75953 avr_updi: data-bit: "0"
75953-75962 avr_updi: data-bit: "0"
75962-75971 avr_updi: data-bit: "1"
75971-75980 avr_updi: data-bit: "0"
75980-75989 avr_updi: data-bit: "0"
75989-75998 avr_updi: data-bit: "1"
75998-76007 avr_updi: data-bit: "1"
76007-76025 avr_updi: stop-bit: "Stop bit" "Stop" "T"
75926-76025 avr_updi: byte-value: "C8"
75926-76025 avr_updi: updi-opcode: "Opcode: STCS" "STCS"
76030-76039 avr_updi: start-bit: "Start bit" "Start" "S"
76039-76048 avr_updi: data-bit: "1"
76048-76057 avr_updi: data-bit: "0"
76057-76066 avr_updi: data-bit: "0"
76066-76075 avr_updi: data-bit: "1"
76075-76084 avr_updi: data-bit: "1"
76084-76093 avr_updi: data-bit: "0"
76093-76102 avr_updi: data-bit: "1"
76102-76111 avr_updi: data-bit: "0"
76111-76129 avr_updi: stop-bit: "Stop bit" "Stop" "T"
76030-76129 avr_updi: byte-value: "59"
76030-76129 avr_updi: updi-data: "Data: 59" "59"
75821-76129 avr_updi: updi: "STCS [08], 59" "STCS"
77179-77187 avr_updi: start-bit: "Start bit" "Start" "S"
77187-77196 avr_updi: data-bit: "x"
77196-77204 avr_updi: data-bit: "x"
77204-77213 avr_updi: data-bit: "x"
77213-77222 avr_updi: data-bit: "x"
77222-77231 avr_updi: data-bit: "x"
77231-77239 avr_updi: data-bit: "x"
77239-77248 avr_updi: data-bit: "x"
77248-77257 avr_updi: data-bit: "x"
77257-77275 avr_updi: stop-bit: "Stop bit" "Stop" "T"
77179-77275 avr_updi: byte-value: "55"
77179-77275 avr_updi: sync: "SYNC"
77283-77292 avr_updi: start-bit: "Start bit" "Start" "S"
77292-77301 avr_updi: data-bit: "0"
77301-77310 avr_updi: data-bit: "0"
77310-77319 avr_updi: data-bit: "0"
77319-77328 avr_updi: data-bit: "1"
77328-77337 avr_updi: data-bit: "0"
77337-77346 avr_updi: data-bit: "0"
77346-77355 avr_updi: data-bit: "1"
77355-77364 avr_updi: data-bit: "1"
77364-77382 avr_updi: stop-bit: "Stop bit" "Stop" "T"
77283-77382 avr_updi: byte-value: "C8"
77283-77382 avr_updi: updi-opcode: "Opcode: STCS" "STCS"
77387-77396 avr_updi: start-bit: "Start bit" "Start" "S"
77396-77405 avr_updi: data-bit: "0"
77405-77414 avr_updi: data-bit: "0"
77414-77423 avr_updi: data-bit: "0"
77423-77432 avr_updi: data-bit: "0"
77432-77441 avr_updi: data-bit: "0"
77441-77450 avr_updi: data-bit: "0"
77450-77459 avr_updi: data-bit: "0"
77459-77468 avr_updi: data-bit: "0"
77468-77486 avr_updi: stop-bit: "Stop bit" "Stop" "T"
77387-77486 avr_updi: byte-value: "00"
77387-77486 avr_updi: updi-data: "Data: 00" "00"
77179-77486 avr_updi: updi: "STCS [08], 00" "STCS"
78606-78614 avr_updi: start-bit: "Start bit" "Start" "S"
78614-78623 avr_updi: data-bit: "x"
78623-78631 avr_updi: data-bit: "x"
78631-78640 avr_updi: data-bit: "x"
78640-78649 avr_updi: data-bit: "x"
78649-78658 avr_updi: data-bit: "x"
78658-78666 avr_updi: data-bit: "x"
78666-78675 avr_updi: data-bit: "x"
78675-78684 avr_updi: data-bit: "x"
78684-78702 avr_updi: stop-bit: "Stop bit" "Stop" "T"
78606-78702 avr_updi: byte-value: "55"
78606-78702 avr_updi: sync: "SYNC"
78710-78719 avr_updi: start-bit: "Start bit" "Start" "S"
78719-78728 avr_updi: data-bit: "1"
78728-78737 avr_updi: data-bit: "1"
78737-78746 avr_updi: data-bit: "0"
78746-78755 avr_updi: data-bit: "1"
78755-78764 avr_updi: data-bit: "0"
78764-78773 avr_updi: data-bit: "0"
78773-78782 avr_updi: data-bit: "0"
78782-78791 avr_updi: data-bit: "1"
78791-78809 avr_updi: stop-bit: "Stop bit" "Stop" "T"
78710-78809 avr_updi: byte-value: "8B"
78710-78809 avr_updi: updi-opcode: "Opcode: LDCS" "LDCS"
79909-79918 avr_updi: start-bit: "Start bit" "Start" "S"
79918-79927 avr_updi: data-bit: "1"
79927-79936 avr_updi: data-bit: "0"
79936-79945 avr_updi: data-bit: "0"
79945-79954 avr_updi: data-bit: "0"
79954-79963 avr_updi: data-bit: "0"
79963-79972 avr_updi: data-bit: "1"
79972-79981 avr_updi: data-bit: "0"
79981-79990 avr_updi: data-bit: "0"
79990-80008 avr_updi: stop-bit: "Stop bit" "Stop" "T"
79909-80008 avr_updi: byte-value: "21"
79909-80008 avr_updi: updi-data: "Data: 21" "21"
78606-80008 avr_updi: updi: "LDCS [0B] <- 21" "LDCS"
182008-182017 avr_updi: start-bit: "Start bit" "Start" "S"
182017-182025 avr_updi: data-bit: "x"
182025-182034 avr_updi: data-bit: "x"
182034-182043 avr_updi: data-bit: "x"
182043-182051 avr_updi: data-bit: "x"
182051-182060 avr_updi: data-bit: "x"
182060-182069 avr_updi: data-bit: "x"
182069-182078 avr_updi: data-bit: "x"
182078-182087 avr_updi: data-bit: "x"
182087-182105 avr_updi: stop-bit: "Stop bit" "Stop" "T"
182008-182105 avr_updi: byte-value: "55"
182008-182105 avr_updi: sync: "SYNC"
182112-182121 avr_updi: start-bit: "Start bit" "Start" "S"
182121-182130 avr_updi: data-bit: "1"
182130-182139 avr_updi: data-bit: "1"
182139-182148 avr_updi: data-bit: "0"
182148-182157 avr_updi: data-bit: "1"
182157-182166 avr_updi: data-bit: "0"
182166-182175 avr_updi: data-bit: "0"
182175-182184 avr_updi: data-bit: "0"
182184-182193 avr_updi: data-bit: "1"
182193-182211 avr_updi: stop-bit: "Stop bit" "Stop" "T"
182112-182211 avr_updi: byte-value: "8B"
182112-182211 avr_updi: updi-opcode: "Opcode: LDCS" "LDCS"
183312-183321 avr_updi: start-bit: "Start bit" "Start" "S"
183321-183330 avr_updi: data-bit: "1"
183330-183339 avr_updi: data-bit: "0"
183339-183348 avr_updi: data-bit: "0"
183348-183357 avr_updi: data-bit: "0"
183357-183366 avr_updi: data-bit: "0"
183366-183375 avr_updi: data-bit: "0"
183375-183384 avr_updi: data-bit: "0"
183384-183393 avr_updi: data-bit: "0"
183393-183411 avr_updi: stop-bit: "Stop bit" "Stop" "T"
183312-183411 avr_updi: byte-value: "01"
183312-183411 avr_updi: updi-data: "Data: 01" "01"
182008-183411 avr_updi: updi: "LDCS [0B] <- 01" "LDCS"
285602-285611 avr_updi: start-bit: "Start bit" "Start" "S"
285611-285620 avr_updi: data-bit: "x"
285620-285628 avr_updi: data-bit: "x"
285628-285637 avr_updi: data-bit: "x"
285637-285645 avr_updi: data-bit: "x"
285645-285654 avr_updi: data-bit: "x"
285654-285663 avr_updi: data-bit: "x"
285663-285672 avr_updi: data-bit: "x"
285672-285681 avr_updi: data-bit: "x"
285681-285699 avr_updi: stop-bit: "Stop bit" "Stop" "T"
285602-285699 avr_updi: byte-value: "55"
285602-285699 avr_updi: sync: "SYNC"
285707-285716 avr_updi: start-bit: "Start bit" "Start" "S"
285716-285725 avr_updi: data-bit: "1"
285725-285734 avr_updi: data-bit: "1"
285734-285743 avr_updi: data-bit: "0"
285743-285752 avr_updi: data-bit: "1"
285752-285761 avr_updi: data-bit: "0"
285761-285770 avr_updi: data-bit: "0"
285770-285779 avr_updi: data-bit: "0"
285779-285788 avr_updi: data-bit: "1"
285788-285806 avr_updi: stop-bit: "Stop bit" "Stop" "T"
285707-285806 avr_updi: byte-value: "8B"
285707-285806 avr_updi: updi-opcode: "Opcode: LDCS" "LDCS"
286906-286915 avr_updi: start-bit: "Start bit" "Start" "S"
286915-286924 avr_updi: data-bit: "0"
286924-286933 avr_updi: data-bit: "0"
286933-286942 avr_updi: data-bit: "0"
286942-286951 avr_updi: data-bit: "1"
286951-286960 avr_updi: data-bit: "0"
286960-286969 avr_updi: data-bit: "0"
286969-286978 avr_updi: data-bit: "0"
286978-286987 avr_updi: data-bit: "0"
286987-287005 avr_updi: stop-bit: "Stop bit" "Stop" "T"
286906-287005 avr_updi: byte-value: "08"
286906-287005 avr_updi: updi-data: "Data: 08" "08"
285602-287005 avr_updi: updi: "LDCS [0B] <- 08" "LDCS"
290632-290640 avr_updi: start-bit: "Start bit" "Start" "S"
290640-290649 avr_updi: data-bit: "x"
290649-290658 avr_updi: data-bit: "x"
290658-290667 avr_updi: data-bit: "x"
290667-290675 avr_updi: data-bit: "x"
290675-290684 avr_updi: data-bit: "x"
290684-290692 avr_updi: data-bit: "x"
290692-290701 avr_updi: data-bit: "x"
290701-290710 avr_updi: data-bit: "x"
290710-290728 avr_updi: stop-bit: "Stop bit" "Stop" "T"
290632-290728 avr_updi: byte-value: "55"
290632-290728 avr_updi: sync: "SYNC"
290736-290745 avr_updi: start-bit: "Start bit" "Start" "S"
290745-290754 avr_updi: data-bit: "1"
290754-290763 avr_updi: data-bit: "0"
290763-290772 avr_updi: data-bit: "0"
290772-290781 avr_updi: data-bit: "1"
290781-290790 avr_updi: data-bit: "0"
290790-290799 avr_updi: data-bit: "1"
290799-290808 avr_updi: data-bit: "1"
290808-290817 avr_updi: data-bit: "0"
290817-290835 avr_updi: stop-bit: "Stop bit" "Stop" "T"
290736-290835 avr_updi: byte-value: "69"
290736-290835 avr_updi: updi-opcode: "Opcode: ST" "ST"
290841-290850 avr_updi: start-bit: "Start bit" "Start" "S"
290850-290859 avr_updi: data-bit: "0"
290859-290868 avr_updi: data-bit: "0"
290868-290877 avr_updi: data-bit: "0"
290877-290886 avr_updi: data-bit: "0"
290886-290895 avr_updi: data-bit: "0"
290895-290904 avr_updi: data-bit: "0"
290904-290913 avr_updi: data-bit: "0"
290913-290922 avr_updi: data-bit: "0"
290922-290940 avr_updi: stop-bit: "Stop bit" "Stop" "T"
290841-290940 avr_updi: byte-value: "00"
290945-290954 avr_updi: start-bit: "Start bit" "Start" "S"
290954-290963 avr_updi: data-bit: "1"
290963-290972 avr_updi: data-bit: "0"
290972-290981 avr_updi: data-bit: "0"
290981-290990 avr_updi: data-bit: "0"
290990-290999 avr_updi: data-bit: "1"
290999-291008 avr_updi: data-bit: "0"
291008-291017 avr_updi: data-bit: "0"
291017-291026 avr_updi: data-bit: "0"
291026-291044 avr_updi: stop-bit: "Stop bit" "Stop" "T"
290945-291044 avr_updi: byte-value: "11"
290945-291044 avr_updi: updi-data: "Data: 1100" "1100"
292145-292154 avr_updi: start-bit: "Start bit" "Start" "S"
292154-292163 avr_updi: data-bit: "0"
292163-292172 avr_updi: data-bit: "0"
292172-292181 avr_updi: data-bit: "0"
292181-292190 avr_updi: data-bit: "0"
292190-292199 avr_updi: data-bit: "0"
292199-292208 avr_updi: data-bit: "0"
292208-292217 avr_updi: data-bit: "1"
292217-292226 avr_updi: data-bit: "0"
292226-292244 avr_updi: stop-bit: "Stop bit" "Stop" "T"
292145-292244 avr_updi: byte-value: "40"
292145-292244 avr_updi: updi-ack: "ACK"
290632-292244 avr_updi: updi: "ST P, 1100" "ST"
293947-293956 avr_updi: start-bit: "Start bit" "Start" "S"
293956-293964 avr_updi: data-bit: "x"
293964-293973 avr_updi: data-bit: "x"
293973-293982 avr_updi: data-bit: "x"
293982-293990 avr_updi: data-bit: "x"
293990-293999 avr_updi: data-bit: "x"
293999-294008 avr_updi: data-bit: "x"
294008-294017 avr_updi: data-bit: "x"
294017-294026 avr_updi: data-bit: "x"
294026-294044 avr_updi: stop-bit: "Stop bit" "Stop" "T"
293947-294044 avr_updi: byte-value: "55"
293947-294044 avr_updi: sync: "SYNC"
294052-294061 avr_updi: start-bit: "Start bit" "Start" "S"
294061-294070 avr_updi: data-bit: "0"
294070-294079 avr_updi: data-bit: "0"
294079-294088 avr_updi: data-bit: "0"
294088-294097 avr_updi: data-bit: "0"
294097-294106 avr_updi: data-bit: "0"
294106-294115 avr_updi: data-bit: "1"
294115-294124 avr_updi: data-bit: "0"
294124-294133 avr_updi: data-bit: "1"
294133-294151 avr_updi: stop-bit: "Stop bit" "Stop" "T"
294052-294151 avr_updi: byte-value: "A0"
294052-294151 avr_updi: updi-opcode: "Opcode: REPEAT" "REPEAT"
294156-294165 avr_updi: start-bit: "Start bit" "Start" "S"
294165-294174 avr_updi: data-bit: "0"
294174-294183 avr_updi: data-bit: "1"
294183-294192 avr_updi: data-bit: "0"
294192-294201 avr_updi: data-bit: "0"
294201-294210 avr_updi: data-bit: "0"
294210-294219 avr_updi: data-bit: "0"
294219-294228 avr_updi: data-bit: "0"
294228-294237 avr_updi: data-bit: "0"
294237-294255 avr_updi: stop-bit: "Stop bit" "Stop" "T"
294156-294255 avr_updi: byte-value: "02"
294156-294255 avr_updi: updi-data: "Count: 02" "02"
293947-294255 avr_updi: updi: "REPEAT 2" "REPEAT"
295322-295330 avr_updi: start-bit: "Start bit" "Start" "S"
295330-295339 avr_updi: data-bit: "x"
295339-295348 avr_updi: data-bit: "x"
295348-295357 avr_updi: data-bit: "x"
295357-295365 avr_updi: data-bit: "x"
295365-295374 avr_updi: data-bit: "x"
295374-295383 avr_updi: data-bit: "x"
295383-295392 avr_updi: data-bit: "x"
295392-295401 avr_updi: data-bit: "x"
295401-295419 avr_updi: stop-bit: "Stop bit" "Stop" "T"
295322-295419 avr_updi: byte-value: "55"
295322-295419 avr_updi: sync: "SYNC"
295426-295435 avr_updi: start-bit: "Start bit" "Start" "S"
295435-295444 avr_updi: data-bit: "0"
295444-295453 avr_updi: data-bit: "0"
295453-295462 avr_updi: data-bit: "1"
295462-295471 avr_updi: data-bit: "0"
295471-295480 avr_updi: data-bit: "0"
295480-295489 avr_updi: data-bit: "1"
295489-295498 avr_updi: data-bit: "0"
295498-295507 avr_updi: data-bit: "0"
295507-295525 avr_updi: stop-bit: "Stop bit" "Stop" "T"
295426-295525 avr_updi: byte-value: "24"
295426-295525 avr_updi: updi-opcode: "Opcode: LD" "LD"
296626-296635 avr_updi: start-bit: "Start bit" "Start" "S"
296635-296644 avr_updi: data-bit: "0"
296644-296653 avr_updi: data-bit: "1"
296653-296662 avr_updi: data-bit: "1"
296662-296671 avr_updi: data-bit: "1"
296671-296680 avr_updi: data-bit: "1"
296680-296689 avr_updi: data-bit: "0"
296689-296698 avr_updi: data-bit: "0"
296698-296707 avr_updi: data-bit: "0"
296707-296725 avr_updi: stop-bit: "Stop bit" "Stop" "T"
296626-296725 avr_updi: byte-value: "1E"
296626-296725 avr_updi: updi-data: "Data: 1E" "1E"
295322-296725 avr_updi: updi: "LD [P+] <- 1E" "LD"
296731-296740 avr_updi: start-bit: "Start bit" "Start" "S"
296740-296749 avr_updi: data-bit: "1"
296749-296758 avr_updi: data-bit: "1"
296758-296767 avr_updi: data-bit: "0"
296767-296776 avr_updi: data-bit: "0"
296776-296785 avr_updi: data-bit: "1"
296785-296794 avr_updi: data-bit: "0"
296794-296803 avr_updi: data-bit: "0"
296803-296812 avr_updi: data-bit: "1"
296812-296830 avr_updi: stop-bit: "Stop bit" "Stop" "T"
296731-296830 avr_updi: byte-value: "93"
296731-296830 avr_updi: updi-data: "Data: 93" "93"
296731-296830 avr_updi: updi: "... <- 93" "93"
296842-296851 avr_updi: start-bit: "Start bit" "Start" "S"
296851-296860 avr_updi: data-bit: "0"
296860-296869 avr_updi: data-bit: "1"
296869-296878 avr_updi: data-bit: "0"
296878-296887 avr_updi: data-bit: "0"
296887-296896 avr_updi: data-bit: "0"
296896-296905 avr_updi: data-bit: "1"
296905-296914 avr_updi: data-bit: "0"
296914-296923 avr_updi: data-bit: "0"
296923-296941 avr_updi: stop-bit: "Stop bit" "Stop" "T"
296842-296941 avr_updi: byte-value: "22"
296842-296941 avr_updi: updi-data: "Data: 22" "22"
296842-296941 avr_updi: updi: "... <- 22" "22"
299055-299063 avr_updi: start-bit: "Start bit" "Start" "S"
299063-299072 avr_updi: data-bit: "x"
299072-299081 avr_updi: data-bit: "x"
299081-299090 avr_updi: data-bit: "x"
299090-299098 avr_updi: data-bit: "x"
299098-299107 avr_updi: data-bit: "x"
299107-299116 avr_updi: data-bit: "x"
299116-299125 avr_updi: data-bit: "x"
299125-299134 avr_updi: data-bit: "x"
299134-299152 avr_updi: stop-bit: "Stop bit" "Stop" "T"
299055-299152 avr_updi: byte-value: "55"
299055-299152 avr_updi: sync: "SYNC"
299159-299168 avr_updi: start-bit: "Start bit" "Start" "S"
299168-299177 avr_updi: data-bit: "0"
299177-299186 avr_updi: data-bit: "0"
299186-299195 avr_updi: data-bit: "1"
299195-299204 avr_updi: data-bit: "0"
299204-299213 avr_updi: data-bit: "0"
299213-299222 avr_updi: data-bit: "0"
299222-299231 avr_updi: data-bit: "0"
299231-299240 avr_updi: data-bit: "0"
299240-299258 avr_updi: stop-bit: "Stop bit" "Stop" "T"
299159-299258 avr_updi: byte-value: "04"
299159-299258 avr_updi: updi-opcode: "Opcode: LDS" "LDS"
299264-299273 avr_updi: start-bit: "Start bit" "Start" "S"
299273-299282 avr_updi: data-bit: "0"
299282-299291 avr_updi: data-bit: "0"
299291-299300 avr_updi: data-bit: "0"
299300-299309 avr_updi: data-bit: "0"
299309-299318 avr_updi: data-bit: "0"
299318-299327 avr_updi: data-bit: "0"
299327-299336 avr_updi: data-bit: "0"
299336-299345 avr_updi: data-bit: "1"
299345-299363 avr_updi: stop-bit: "Stop bit" "Stop" "T"
299264-299363 avr_updi: byte-value: "80"
299368-299377 avr_updi: start-bit: "Start bit" "Start" "S"
299377-299386 avr_updi: data-bit: "0"
299386-299395 avr_updi: data-bit: "1"
299395-299404 avr_updi: data-bit: "0"
299404-299413 avr_updi: data-bit: "0"
299413-299422 avr_updi: data-bit: "1"
299422-299431 avr_updi: data-bit: "0"
299431-299440 avr_updi: data-bit: "0"
299440-299449 avr_updi: data-bit: "0"
299449-299467 avr_updi: stop-bit: "Stop bit" "Stop" "T"
299368-299467 avr_updi: byte-value: "12"
299368-299467 avr_updi: updi-addr: "Addr: 1280" "1280"
300568-300577 avr_updi: start-bit: "Start bit" "Start" "S"
300577-300586 avr_updi: data-bit: "0"
300586-300595 avr_updi: data-bit: "0"
300595-300604 avr_updi: data-bit: "0"
300604-300613 avr_updi: data-bit: "0"
300613-300622 avr_updi: data-bit: "0"
300622-300631 avr_updi: data-bit: "0"
300631-300640 avr_updi: data-bit: "0"
300640-300649 avr_updi: data-bit: "0"
300649-300667 avr_updi: stop-bit: "Stop bit" "Stop" "T"
300568-300667 avr_updi: byte-value: "00"
300568-300667 avr_updi: updi-data: "Data: 00" "00"
299055-300667 avr_updi: updi: "LDS 1280 <- 00" "LDS"
302657-302666 avr_updi: start-bit: "Start bit" "Start" "S"
302666-302675 avr_updi: data-bit: "x"
302675-302683 avr_updi: data-bit: "x"
302683-302692 avr_updi: data-bit: "x"
302692-302701 avr_updi: data-bit: "x"
302701-302710 avr_updi: data-bit: "x"
302710-302718 avr_updi: data-bit: "x"
302718-302727 avr_updi: data-bit: "x"
302727-302736 avr_updi: data-bit: "x"
302736-302754 avr_updi: stop-bit: "Stop bit" "Stop" "T"
302657-302754 avr_updi: byte-value: "55"
302657-302754 avr_updi: sync: "SYNC"
302762-302771 avr_updi: start-bit: "Start bit" "Start" "S"
302771-302780 avr_updi: data-bit: "0"
302780-302789 avr_updi: data-bit: "0"
302789-302798 avr_updi: data-bit: "1"
302798-302807 avr_updi: data-bit: "0"
302807-302816 avr_updi: data-bit: "0"
302816-302825 avr_updi: data-bit: "0"
302825-302834 avr_updi: data-bit: "0"
302834-302843 avr_updi: data-bit: "0"
302843-302861 avr_updi: stop-bit: "Stop bit" "Stop" "T"
302762-302861 avr_updi: byte-value: "04"
302762-302861 avr_updi: updi-opcode: "Opcode: LDS" "LDS"
302866-302875 avr_updi: start-bit: "Start bit" "Start" "S"
302875-302884 avr_updi: data-bit: "1"
302884-302893 avr_updi: data-bit: "0"
302893-302902 avr_updi: data-bit: "0"
302902-302911 avr_updi: data-bit: "0"
302911-302920 avr_updi: data-bit: "0"
302920-302929 avr_updi: data-bit: "0"
302929-302938 avr_updi: data-bit: "0"
302938-302947 avr_updi: data-bit: "1"
302947-302965 avr_updi: stop-bit: "Stop bit" "Stop" "T"
302866-302965 avr_updi: byte-value: "81"
302971-302980 avr_updi: start-bit: "Start bit" "Start" "S"
302980-302989 avr_updi: data-bit: "0"
302989-302998 avr_updi: data-bit: "1"
302998-303007 avr_updi: data-bit: "0"
303007-303016 avr_updi: data-bit: "0"
303016-303025 avr_updi: data-bit: "1"
303025-303034 avr_updi: data-bit: "0"
303034-303043 avr_updi: data-bit: "0"
303043-303052 avr_updi: data-bit: "0"
303052-303070 avr_updi: stop-bit: "Stop bit" "Stop" "T"
302971-303070 avr_updi: byte-value: "12"
302971-303070 avr_updi: updi-addr: "Addr: 1281" "1281"
304179-304188 avr_updi: start-bit: "Start bit" "Start" "S"
304188-304197 avr_updi: data-bit: "0"
304197-304206 avr_updi: data-bit: "0"
304206-304215 avr_updi: data-bit: "0"
304215-304224 avr_updi: data-bit: "0"
304224-304233 avr_updi: data-bit: "0"
304233-304242 avr_updi: data-bit: "0"
304242-304251 avr_updi: data-bit: "0"
304251-304260 avr_updi: data-bit: "0"
304260-304278 avr_updi: stop-bit: "Stop bit" "Stop" "T"
304179-304278 avr_updi: byte-value: "00"
304179-304278 avr_updi: updi-data: "Data: 00" "00"
302657-304278 avr_updi: updi: "LDS 1281 <- 00" "LDS"
305181-305189 avr_updi: start-bit: "Start bit" "Start" "S"
305189-305198 avr_updi: data-bit: "x"
305198-305207 avr_updi: data-bit: "x"
305207-305216 avr_updi: data-bit: "x"
305216-305224 avr_updi: data-bit: "x"
305224-305233 avr_updi: data-bit: "x"
305233-305242 avr_updi: data-bit: "x"
305242-305251 avr_updi: data-bit: "x"
305251-305260 avr_updi: data-bit: "x"
305260-305278 avr_updi: stop-bit: "Stop bit" "Stop" "T"
305181-305278 avr_updi: byte-value: "55"
305181-305278 avr_updi: sync: "SYNC"
305285-305294 avr_updi: start-bit: "Start bit" "Start" "S"
305294-305303 avr_updi: data-bit: "0"
305303-305312 avr_updi: data-bit: "0"
305312-305321 avr_updi: data-bit: "1"
305321-305330 avr_updi: data-bit: "0"
305330-305339 avr_updi: data-bit: "0"
305339-305348 avr_updi: data-bit: "0"
305348-305357 avr_updi: data-bit: "0"
305357-305366 avr_updi: data-bit: "0"
305366-305384 avr_updi: stop-bit: "Stop bit" "Stop" "T"
305285-305384 avr_updi: byte-value: "04"
305285-305384 avr_updi: updi-opcode: "Opcode: LDS" "LDS"
305390-305399 avr_updi: start-bit: "Start bit" "Start" "S"
305399-305408 avr_updi: data-bit: "0"
305408-305417 avr_updi: data-bit: "1"
305417-305426 avr_updi: data-bit: "0"
305426-305435 avr_updi: data-bit: "0"
305435-305444 avr_updi: data-bit: "0"
305444-305453 avr_updi: data-bit: "0"
305453-305462 avr_updi: data-bit: "0"
305462-305471 avr_updi: data-bit: "1"
305471-305489 avr_updi: stop-bit: "Stop bit" "Stop" "T"
305390-305489 avr_updi: byte-value: "82"
305494-305503 avr_updi: start-bit: "Start bit" "Start" "S"
305503-305512 avr_updi: data-bit: "0"
305512-305521 avr_updi: data-bit: "1"
305521-305530 avr_updi: data-bit: "0"
305530-305539 avr_updi: data-bit: "0"
305539-305548 avr_updi: data-bit: "1"
305548-305557 avr_updi: data-bit: "0"
305557-305566 avr_updi: data-bit: "0"
305566-305575 avr_updi: data-bit: "0"
305575-305593 avr_updi: stop-bit: "Stop bit" "Stop" "T"
305494-305593 avr_updi: byte-value: "12"
305494-305593 avr_updi: updi-addr: "Addr: 1282" "1282"
306694-306703 avr_updi: start-bit: "Start bit" "Start" "S"
306703-306712 avr_updi: data-bit: "0"
306712-306721 avr_updi: data-bit: "1"
306721-306730 avr_updi: data-bit: "0"
306730-306739 avr_updi: data-bit: "0"
306739-306748 avr_updi: data-bit: "0"
306748-306757 avr_updi: data-bit: "0"
306757-306766 avr_updi: data-bit: "0"
306766-306775 avr_updi: data-bit: "0"
306775-306793 avr_updi: stop-bit: "Stop bit" "Stop" "T"
306694-306793 avr_updi: byte-value: "02"
306694-306793 avr_updi: updi-data: "Data: 02" "02"
305181-306793 avr_updi: updi: "LDS 1282 <- 02" "LDS"
307948-307956 avr_updi: start-bit: "Start bit" "Start" "S"
307956-307965 avr_updi: data-bit: "x"
307965-307974 avr_updi: data-bit: "x"
307974-307983 avr_updi: data-bit: "x"
307983-307991 avr_updi: data-bit: "x"
307991-308000 avr_updi: data-bit: "x"
308000-308009 avr_updi: data-bit: "x"
308009-308018 avr_updi: data-bit: "x"
308018-308027 avr_updi: data-bit: "x"
308027-308045 avr_updi: stop-bit: "Stop bit" "Stop" "T"
307948-308045 avr_updi: byte-value: "55"
307948-308045 avr_updi: sync: "SYNC"
308052-308061 avr_updi: start-bit: "Start bit" "Start" "S"
308061-308070 avr_updi: data-bit: "0"
308070-308079 avr_updi: data-bit: "0"
308079-308088 avr_updi: data-bit: "1"
308088-308097 avr_updi: data-bit: "0"
308097-308106 avr_updi: data-bit: "0"
308106-308115 avr_updi: data-bit: "0"
308115-308124 avr_updi: data-bit: "0"
308124-308133 avr_updi: data-bit: "0"
308133-308151 avr_updi: stop-bit: "Stop bit" "Stop" "T"
308052-308151 avr_updi: byte-value: "04"
308052-308151 avr_updi: updi-opcode: "Opcode: LDS" "LDS"
308157-308166 avr_updi: start-bit: "Start bit" "Start" "S"
308166-308175 avr_updi: data-bit: "0"
308175-308184 avr_updi: data-bit: "0"
308184-308193 avr_updi: data-bit: "1"
308193-308202 avr_updi: data-bit: "0"
308202-308211 avr_updi: data-bit: "0"
308211-308220 avr_updi: data-bit: "0"
308220-308229 avr_updi: data-bit: "0"
308229-308238 avr_updi: data-bit: "1"
308238-308256 avr_updi: stop-bit: "Stop bit" "Stop" "T"
308157-308256 avr_updi: byte-value: "84"
308261-308270 avr_updi: start-bit: "Start bit" "Start" "S"
308270-308279 avr_updi: data-bit: "0"
308279-308288 avr_updi: data-bit: "1"
308288-308297 avr_updi: data-bit: "0"
308297-308306 avr_updi: data-bit: "0"
308306-308315 avr_updi: data-bit: "1"
308315-308324 avr_updi: data-bit: "0"
308324-308333 avr_updi: data-bit: "0"
308333-308342 avr_updi: data-bit: "0"
308342-308360 avr_updi: stop-bit: "Stop bit" "Stop" "T"
308261-308360 avr_updi: byte-value: "12"
308261-308360 avr_updi: updi-addr: "Addr: 1284" "1284"
309461-309470 avr_updi: start-bit: "Start bit" "Start" "S"
309470-309479 avr_updi: data-bit: "0"
309479-309488 avr_updi: data-bit: "0"
309488-309497 avr_updi: data-bit: "0"
309497-309506 avr_updi: data-bit: "0"
309506-309515 avr_updi: data-bit: "0"
309515-309524 avr_updi: data-bit: "0"
309524-309533 avr_updi: data-bit: "0"
309533-309542 avr_updi: data-bit: "0"
309542-309560 avr_updi: stop-bit: "Stop bit" "Stop" "T"
309461-309560 avr_updi: byte-value: "00"
309461-309560 avr_updi: updi-data: "Data: 00" "00"
307948-309560 avr_updi: updi: "LDS 1284 <- 00" "LDS"
310776-310785 avr_updi: start-bit: "Start bit" "Start" "S"
310785-310793 avr_updi: data-bit: "x"
310793-310802 avr_updi: data-bit: "x"
310802-310811 avr_updi: data-bit: "x"
310811-310819 avr_updi: data-bit: "x"
310819-310828 avr_updi: data-bit: "x"
310828-310837 avr_updi: data-bit: "x"
310837-310846 avr_updi: data-bit: "x"
310846-310855 avr_updi: data-bit: "x"
310855-310873 avr_updi: stop-bit: "Stop bit" "Stop" "T"
310776-310873 avr_updi: byte-value: "55"
310776-310873 avr_updi: sync: "SYNC"
310880-310889 avr_updi: start-bit: "Start bit" "Start" "S"
310889-310898 avr_updi: data-bit: "0"
310898-310907 avr_updi: data-bit: "0"
310907-310916 avr_updi: data-bit: "1"
310916-310925 avr_updi: data-bit: "0"
310925-310934 avr_updi: data-bit: "0"
310934-310943 avr_updi: data-bit: "0"
310943-310952 avr_updi: data-bit: "0"
310952-310961 avr_updi: data-bit: "0"
310961-310979 avr_updi: stop-bit: "Stop bit" "Stop" "T"
310880-310979 avr_updi: byte-value: "04"
310880-310979 avr_updi: updi-opcode: "Opcode: LDS" "LDS"
310985-310994 avr_updi: start-bit: "Start bit" "Start" "S"
310994-311003 avr_updi: data-bit: "1"
311003-311012 avr_updi: data-bit: "0"
311012-311021 avr_updi: data-bit: "1"
311021-311030 avr_updi: data-bit: "0"
311030-311039 avr_updi: data-bit: "0"
311039-311048 avr_updi: data-bit: "0"
311048-311057 avr_updi: data-bit: "0"
311057-311066 avr_updi: data-bit: "1"
311066-311084 avr_updi: stop-bit: "Stop bit" "Stop" "T"
310985-311084 avr_updi: byte-value: "85"
311089-311098 avr_updi: start-bit: "Start bit" "Start" "S"
311098-311107 avr_updi: data-bit: "0"
311107-311116 avr_updi: data-bit: "1"
311116-311125 avr_updi: data-bit: "0"
311125-311134 avr_updi: data-bit: "0"
311134-311143 avr_updi: data-bit: "1"
311143-311152 avr_updi: data-bit: "0"
311152-311161 avr_updi: data-bit: "0"
311161-311170 avr_updi: data-bit: "0"
311170-311188 avr_updi: stop-bit: "Stop bit" "Stop" "T"
311089-311188 avr_updi: byte-value: "12"
311089-311188 avr_updi: updi-addr: "Addr: 1285" "1285"
312289-312298 avr_updi: start-bit: "Start bit" "Start" "S"
312298-312307 avr_updi: data-bit: "1"
312307-312316 avr_updi: data-bit: "0"
312316-312325 avr_updi: data-bit: "1"
312325-312334 avr_updi: data-bit: "0"
312334-312343 avr_updi: data-bit: "0"
312343-312352 avr_updi: data-bit: "0"
312352-312361 avr_updi: data-bit: "1"
312361-312370 avr_updi: data-bit: "1"
312370-312388 avr_updi: stop-bit: "Stop bit" "Stop" "T"
312289-312388 avr_updi: byte-value: "C5"
312289-312388 avr_updi: updi-data: "Data: C5" "C5"
310776-312388 avr_updi: updi: "LDS 1285 <- C5" "LDS"
314379-314387 avr_updi: start-bit: "Start bit" "Start" "S"
314387-314396 avr_updi: data-bit: "x"
314396-314404 avr_updi: data-bit: "x"
314404-314413 avr_updi: data-bit: "x"
314413-314422 avr_updi: data-bit: "x"
314422-314431 avr_updi: data-bit: "x"
314431-314439 avr_updi: data-bit: "x"
314439-314448 avr_updi: data-bit: "x"
314448-314457 avr_updi: data-bit: "x"
314457-314475 avr_updi: stop-bit: "Stop bit" "Stop" "T"
314379-314475 avr_updi: byte-value: "55"
314379-314475 avr_updi: sync: "SYNC"
314483-314492 avr_updi: start-bit: "Start bit" "Start" "S"
314492-314501 avr_updi: data-bit: "0"
314501-314510 avr_updi: data-bit: "0"
314510-314519 avr_updi: data-bit: "1"
314519-314528 avr_updi: data-bit: "0"
314528-314537 avr_updi: data-bit: "0"
314537-314546 avr_updi: data-bit: "0"
314546-314555 avr_updi: data-bit: "0"
314555-314564 avr_updi: data-bit: "0"
314564-314582 avr_updi: stop-bit: "Stop bit" "Stop" "T"
314483-314582 avr_updi: byte-value: "04"
314483-314582 avr_updi: updi-opcode: "Opcode: LDS" "LDS"
314587-314596 avr_updi: start-bit: "Start bit" "Start" "S"
314596-314605 avr_updi: data-bit: "0"
314605-314614 avr_updi: data-bit: "1"
314614-314623 avr_updi: data-bit: "1"
314623-314632 avr_updi: data-bit: "0"
314632-314641 avr_updi: data-bit: "0"
314641-314650 avr_updi: data-bit: "0"
314650-314659 avr_updi: data-bit: "0"
314659-314668 avr_updi: data-bit: "1"
314668-314686 avr_updi: stop-bit: "Stop bit" "Stop" "T"
314587-314686 avr_updi: byte-value: "86"
314692-314701 avr_updi: start-bit: "Start bit" "Start" "S"
314701-314710 avr_updi: data-bit: "0"
314710-314719 avr_updi: data-bit: "1"
314719-314728 avr_updi: data-bit: "0"
314728-314737 avr_updi: data-bit: "0"
314737-314746 avr_updi: data-bit: "1"
314746-314755 avr_updi: data-bit: "0"
314755-314764 avr_updi: data-bit: "0"
314764-314773 avr_updi: data-bit: "0"
314773-314791 avr_updi: stop-bit: "Stop bit" "Stop" "T"
314692-314791 avr_updi: byte-value: "12"
314692-314791 avr_updi: updi-addr: "Addr: 1286" "1286"
315892-315901 avr_updi: start-bit: "Start bit" "Start" "S"
315901-315910 avr_updi: data-bit: "1"
315910-315919 avr_updi: data-bit: "1"
315919-315928 avr_updi: data-bit: "1"
315928-315937 avr_updi: data-bit: "0"
315937-315946 avr_updi: data-bit: "0"
315946-315955 avr_updi: data-bit: "0"
315955-315964 avr_updi: data-bit: "0"
315964-315973 avr_updi: data-bit: "0"
315973-315991 avr_updi: stop-bit: "Stop bit" "Stop" "T"
315892-315991 avr_updi: byte-value: "07"
315892-315991 avr_updi: updi-data: "Data: 07" "07"
314379-315991 avr_updi: updi: "LDS 1286 <- 07" "LDS"
317529-317537 avr_updi: start-bit: "Start bit" "Start" "S"
317537-317546 avr_updi: data-bit: "x"
317546-317554 avr_updi: data-bit: "x"
317554-317563 avr_updi: data-bit: "x"
317563-317572 avr_updi: data-bit: "x"
317572-317581 avr_updi: data-bit: "x"
317581-317589 avr_updi: data-bit: "x"
317589-317598 avr_updi: data-bit: "x"
317598-317607 avr_updi: data-bit: "x"
317607-317625 avr_updi: stop-bit: "Stop bit" "Stop" "T"
317529-317625 avr_updi: byte-value: "55"
317529-317625 avr_updi: sync: "SYNC"
317633-317642 avr_updi: start-bit: "Start bit" "Start" "S"
317642-317651 avr_updi: data-bit: "0"
317651-317660 avr_updi: data-bit: "0"
317660-317669 avr_updi: data-bit: "1"
317669-317678 avr_updi: data-bit: "0"
317678-317687 avr_updi: data-bit: "0"
317687-317696 avr_updi: data-bit: "0"
317696-317705 avr_updi: data-bit: "0"
317705-317714 avr_updi: data-bit: "0"
317714-317732 avr_updi: stop-bit: "Stop bit" "Stop" "T"
317633-317732 avr_updi: byte-value: "04"
317633-317732 avr_updi: updi-opcode: "Opcode: LDS" "LDS"
317737-317746 avr_updi: start-bit: "Start bit" "Start" "S"
317746-317755 avr_updi: data-bit: "1"
317755-317764 avr_updi: data-bit: "1"
317764-317773 avr_updi: data-bit: "1"
317773-317782 avr_updi: data-bit: "0"
317782-317791 avr_updi: data-bit: "0"
317791-317800 avr_updi: data-bit: "0"
317800-317809 avr_updi: data-bit: "0"
317809-317818 avr_updi: data-bit: "1"
317818-317836 avr_updi: stop-bit: "Stop bit" "Stop" "T"
317737-317836 avr_updi: byte-value: "87"
317842-317851 avr_updi: start-bit: "Start bit" "Start" "S"
317851-317860 avr_updi: data-bit: "0"
317860-317869 avr_updi: data-bit: "1"
317869-317878 avr_updi: data-bit: "0"
317878-317887 avr_updi: data-bit: "0"
317887-317896 avr_updi: data-bit: "1"
317896-317905 avr_updi: data-bit: "0"
317905-317914 avr_updi: data-bit: "0"
317914-317923 avr_updi: data-bit: "0"
317923-317941 avr_updi: stop-bit: "Stop bit" "Stop" "T"
317842-317941 avr_updi: byte-value: "12"
317842-317941 avr_updi: updi-addr: "Addr: 1287" "1287"
319041-319050 avr_updi: start-bit: "Start bit" "Start" "S"
319050-319059 avr_updi: data-bit: "0"
319059-319068 avr_updi: data-bit: "0"
319068-319077 avr_updi: data-bit: "0"
319077-319086 avr_updi: data-bit: "0"
319086-319095 avr_updi: data-bit: "0"
319095-319104 avr_updi: data-bit: "0"
319104-319113 avr_updi: data-bit: "0"
319113-319122 avr_updi: data-bit: "0"
319122-319140 avr_updi: stop-bit: "Stop bit" "Stop" "T"
319041-319140 avr_updi: byte-value: "00"
319041-319140 avr_updi: updi-data: "Data: 00" "00"
317529-319140 avr_updi: updi: "LDS 1287 <- 00" "LDS"
320557-320565 avr_updi: start-bit: "Start bit" "Start" "S"
320565-320574 avr_updi: data-bit: "x"
320574-320582 avr_updi: data-bit: "x"
320582-320591 avr_updi: data-bit: "x"
320591-320600 avr_updi: data-bit: "x"
320600-320609 avr_updi: data-bit: "x"
320609-320617 avr_updi: data-bit: "x"
320617-320626 avr_updi: data-bit: "x"
320626-320635 avr_updi: data-bit: "x"
320635-320653 avr_updi: stop-bit: "Stop bit" "Stop" "T"
320557-320653 avr_updi: byte-value: "55"
320557-320653 avr_updi: sync: "SYNC"
320661-320670 avr_updi: start-bit: "Start bit" "Start" "S"
320670-320679 avr_updi: data-bit: "0"
320679-320688 avr_updi: data-bit: "0"
320688-320697 avr_updi: data-bit: "1"
320697-320706 avr_updi: data-bit: "0"
320706-320715 avr_updi: data-bit: "0"
320715-320724 avr_updi: data-bit: "0"
320724-320733 avr_updi: data-bit: "0"
320733-320742 avr_updi: data-bit: "0"
320742-320760 avr_updi: stop-bit: "Stop bit" "Stop" "T"
320661-320760 avr_updi: byte-value: "04"
320661-320760 avr_updi: updi-opcode: "Opcode: LDS" "LDS"
320765-320774 avr_updi: start-bit: "Start bit" "Start" "S"
320774-320783 avr_updi: data-bit: "0"
320783-320792 avr_updi: data-bit: "0"
320792-320801 avr_updi: data-bit: "0"
320801-320810 avr_updi: data-bit: "1"
320810-320819 avr_updi: data-bit: "0"
320819-320828 avr_updi: data-bit: "0"
320828-320837 avr_updi: data-bit: "0"
320837-320846 avr_updi: data-bit: "1"
320846-320864 avr_updi: stop-bit: "Stop bit" "Stop" "T"
320765-320864 avr_updi: byte-value: "88"
320870-320879 avr_updi: start-bit: "Start bit" "Start" "S"
320879-320888 avr_updi: data-bit: "0"
320888-320897 avr_updi: data-bit: "1"
320897-320906 avr_updi: data-bit: "0"
320906-320915 avr_updi: data-bit: "0"
320915-320924 avr_updi: data-bit: "1"
320924-320933 avr_updi: data-bit: "0"
320933-320942 avr_updi: data-bit: "0"
320942-320951 avr_updi: data-bit: "0"
320951-320969 avr_updi: stop-bit: "Stop bit" "Stop" "T"
320870-320969 avr_updi: byte-value: "12"
320870-320969 avr_updi: updi-addr: "Addr: 1288" "1288"
322070-322079 avr_updi: start-bit: "Start bit" "Start" "S"
322079-322088 avr_updi: data-bit: "0"
322088-322097 avr_updi: data-bit: "0"
322097-322106 avr_updi: data-bit: "0"
322106-322115 avr_updi: data-bit: "0"
322115-322124 avr_updi: data-bit: "0"
322124-322133 avr_updi: data-bit: "0"
322133-322142 avr_updi: data-bit: "0"
322142-322151 avr_updi: data-bit: "0"
322151-322169 avr_updi: stop-bit: "Stop bit" "Stop" "T"
322070-322169 avr_updi: byte-value: "00"
322070-322169 avr_updi: updi-data: "Data: 00" "00"
320557-322169 avr_updi: updi: "LDS 1288 <- 00" "LDS"
323654-323663 avr_updi: start-bit: "Start bit" "Start" "S"
323663-323672 avr_updi: data-bit: "x"
323672-323680 avr_updi: data-bit: "x"
323680-323689 avr_updi: data-bit: "x"
323689-323698 avr_updi: data-bit: "x"
323698-323706 avr_updi: data-bit: "x"
323706-323715 avr_updi: data-bit: "x"
323715-323724 avr_updi: data-bit: "x"
323724-323733 avr_updi: data-bit: "x"
323733-323751 avr_updi: stop-bit: "Stop bit" "Stop" "T"
323654-323751 avr_updi: byte-value: "55"
323654-323751 avr_updi: sync: "SYNC"
323759-323768 avr_updi: start-bit: "Start bit" "Start" "S"
323768-323777 avr_updi: data-bit: "0"
323777-323786 avr_updi: data-bit: "0"
323786-323795 avr_updi: data-bit: "0"
323795-323804 avr_updi: data-bit: "1"
323804-323813 avr_updi: data-bit: "0"
323813-323822 avr_updi: data-bit: "0"
323822-323831 avr_updi: data-bit: "1"
323831-323840 avr_updi: data-bit: "1"
323840-323858 avr_updi: stop-bit: "Stop bit" "Stop" "T"
323759-323858 avr_updi: byte-value: "C8"
323759-323858 avr_updi: updi-opcode: "Opcode: STCS" "STCS"
323863-323872 avr_updi: start-bit: "Start bit" "Start" "S"
323872-323881 avr_updi: data-bit: "1"
323881-323890 avr_updi: data-bit: "0"
323890-323899 avr_updi: data-bit: "0"
323899-323908 avr_updi: data-bit: "1"
323908-323917 avr_updi: data-bit: "1"
323917-323926 avr_updi: data-bit: "0"
323926-323935 avr_updi: data-bit: "1"
323935-323944 avr_updi: data-bit: "0"
323944-323962 avr_updi: stop-bit: "Stop bit" "Stop" "T"
323863-323962 avr_updi: byte-value: "59"
323863-323962 avr_updi: updi-data: "Data: 59" "59"
323654-323962 avr_updi: updi: "STCS [08], 59" "STCS"
325960-325969 avr_updi: start-bit: "Start bit" "Start" "S"
325969-325978 avr_updi: data-bit: "x"
325978-325986 avr_updi: data-bit: "x"
325986-325995 avr_updi: data-bit: "x"
325995-326003 avr_updi: data-bit: "x"
326003-326012 avr_updi: data-bit: "x"
326012-326021 avr_updi: data-bit: "x"
326021-326030 avr_updi: data-bit: "x"
326030-326039 avr_updi: data-bit: "x"
326039-326057 avr_updi: stop-bit: "Stop bit" "Stop" "T"
325960-326057 avr_updi: byte-value: "55"
325960-326057 avr_updi: sync: "SYNC"
326065-326074 avr_updi: start-bit: "Start bit" "Start" "S"
326074-326083 avr_updi: data-bit: "0"
326083-326092 avr_updi: data-bit: "0"
326092-326101 avr_updi: data-bit: "0"
326101-326110 avr_updi: data-bit: "1"
326110-326119 avr_updi: data-bit: "0"
326119-326128 avr_updi: data-bit: "0"
326128-326137 avr_updi: data-bit: "1"
326137-326146 avr_updi: data-bit: "1"
326146-326164 avr_updi: stop-bit: "Stop bit" "Stop" "T"
326065-326164 avr_updi: byte-value: "C8"
326065-326164 avr_updi: updi-opcode: "Opcode: STCS" "STCS"
326169-326178 avr_updi: start-bit: "Start bit" "Start" "S"
326178-326187 avr_updi: data-bit: "0"
326187-326196 avr_updi: data-bit: "0"
326196-326205 avr_updi: data-bit: "0"
326205-326214 avr_updi: data-bit: "0"
326214-326223 avr_updi: data-bit: "0"
326223-326232 avr_updi: data-bit: "0"
326232-326241 avr_updi: data-bit: "0"
326241-326250 avr_updi: data-bit: "0"
326250-326268 avr_updi: stop-bit: "Stop bit" "Stop" "T"
326169-326268 avr_updi: byte-value: "00"
326169-326268 avr_updi: updi-data: "Data: 00" "00"
325960-326268 avr_updi: updi: "STCS [08], 00" "STCS"
